TemplateID	LmQuery	Query
541229	лицензия медосмотр предрейсовый	лицензия на предрейсовый медосмотр
541231	1 1092н 11 2021 24 минздрав п порядок приказ утв	(п. 1 порядка, утв. приказом минздрава от 24.11.2021 № 1092н).
541231	1092н 11 2021 24 водитель водитель кандидат медицинский минздрав обязательный освидетельствование порядок приказ проведение средство транспортный транспортный утверждение	приказ минздрава от 24.11.2021 № 1092н об утверждении порядка проведения обязательного медицинского освидетельствования водителей транспортных средств (кандидатов в водители транспортных
541746	декларация куда нвос подавать	куда подавать декларацию нвос
541746	декларация объект разный регион сдавать сколько	сколько деклараций сдать если объекты в разных регионах
541746	декларация сдавать сколько	сколько деклараций сдать
541559	документ какой оформлять экология	какие документы по экологии оформить
541559	лист чек экология	чек-лист по экологии
541559	обязанность окружающий организация основной охрана среда	основные обязанности организаций по охране окружающей среды
541609	инструктаж проводить часто	как часто проводить инструктажи
541609	обучение периодичность	периодичность обучения
541753	декларация должный кто нвос подавать	кто должен подавать декларацию нвос
541753	деларация кто нвос сдавать	кто сдает деларацию нвос
541753	декларация кто надо нвос сдавать	кому надо сдать декларацию нвос
541754	декларация нвос плата	декларация о плате за нвос
541754	декларация когда нвос сдавать	когда сдавать декларация нвос
541939	гит какой категория предприятие реестр риск узнавать	как узнать к какой категории риска предприятия в реестре ГИТ
541939	категория предприятие риск	категорию риска на предприятии
541832	нвос плата	плата за нвос
541832	кто нвос платить	кто платит за нвос
541832	воздействие негативный плата	плата за негативное воздействие
541770	декларация надо нвос плата прикладывать	декларация о плате за нвос что надо прикладывать
541770	вставлять декларация депонировать документ который нвос росприроднадзор	как вставить в декларацию НВОС депонируемые документы которые просит Росприроднадзор
541770	декларация документ какой нвос прикладывать	какие документы прикладывать к декларации за нвос
541857	документ какой новый оформлять прием сотрудник	какие документы оформить при приеме нового сотрудника
541857	документ новый перечень прием сотрудник	перечень документов при приеме нового сотрудника
541857	документ перечень прием работа	перечень документов при приеме на работу
541850	новый обучение работник рекомендация	обучение нового работника рекомендации
541850	должный какой новый обучение проходить работник	какое обучение должен пройти новый работник
541850	обучение прием работа	обучение при приеме на работу
544026	декларация нвос	декларация нвос
544026	декларация негативный плата	декларация о плате за негативное
544026	декларация плата	декларация платы
547123	навигатор нарушение требование	навигатор по нарушениям требований ОТ?
547123	охрана труд штраф	штрафы за охрану труда
547123	взыскание вид нарушение ответственность охрана требование труд	ответственность за нарушение требований охраны труда.виды взысканий
547123	штраф	штрафы
547123	кто наказывать нарушение т требование	кого накажут за нарушение требований О.Т.
547123	кто наказывать нарушение охрана требование труд	Кого накажут за нарушения требований охраны труда
547123	нарушение ответственность	Ответственность за нарушение ОТ
546998	безопасность урок экологический	уроки по экологической безопасности
546998	обучаться экология	как обучиться по экологии
546998	направлять обращение обучение отход с	как направить на обучение по обращению с отходами
548377	аналогичный замена заменять и и нет орган оформлять предприятие представительный профсоюз работник сизый сизый	можно ли заменять СИЗ на аналогичные если на предприятии нет профсоюза и представительного органа работников. и как правильно оформить замену СИЗ
548377	замена оформлять сизый	как оформить замену сиз
548384	выдача рубрикатор сизый	рубрикатор выдачи сиз
548384	выдавать зачем сизый	зачем выдавать сиз
548384	выдача сизый требование	требования по выдачи сиз
548384	выдача документ какой сизый требовать	какой документ требует выдачу сиз
548384	290н выдача сизый	290н выдача сиз
544688	возмещение документ отчетный сизый фсс	отчетные документы в фсс на возмещение сиз
544688	возмещение затрата приобретение сизый	возмещение затрат за приобретение сиз
544688	гарантийный письмо сизый фсс	гарантийное письмо на сиз для фсс
544688	какой подлежать сизый фсс	какие сизы подлежат фсс
544688	21г бланк возмещение курган сизый фсс	фсс курган бланки возмещение за сиз в 21г.
544689	07 14 2021 467н минтруд приказ россия	приказ Минтруда России от 14.07.2021 № 467н
544689	возврат сфр	возврат из СФР
544689	580н	580н
544689	07 14 2021gdr 467н	467н от 14.07.2021gdr
544690	компенсация обучение охрана труд	компенсация за обучение по охране труда
544690	вернуть деньги обучение потратить работник фсс	как вернуть деньги, потраченные на обучение работников, через ФСС
546231	2 декларация коап нвос не отход рф с соответствие тп	коап рф об не соответствии 2-тп отхода с декларацией нвос
546231	декларация нвос не плата сдача	не сдача декларации о плате за нвос
546713	действие квалификация повышение срок удостоверение	срок действия удостоверения о повышении квалификации
546713	квалификация повышать часто	как часто повышать квалификацию
546262	2023 вещество государственный загрязнять который мера область окружающий отношение охрана перечень правительство применяться распоряжение распоряжение регулирование рф среда утверждение	распоряжение об утверждении перечня загрязняющих веществ, в отношении которых применяются меры государственного регулирования в области охраны окружающей среды распоряжение правительства рф 2023
546262	вещество какой нвос платить	По каким веществам платить за нвос
548351	защита индивидуальный можно называть средство	что можно назвать средствами индивидуальной защиты
548351	защита индивидуальный относиться средство	что относится к средствам индивидуальной защиты
548356	диэлектрический испытание сизый	испытания диэлектрических сиз
548356	диэлектрический испытывать сизый часто	как часто испытывать сиз в диэлектрические
548334	организовывать работа сделсвами со	Как организовать работу со сделсвами
548334	01 06 2009 290н здравоохранение и и межотраслевой министерство обеспечение обувь одежда правило приказ работник развитие рф социальный специальный специальный утверждение	приказ министерство здравоохранения и социального развития рф от 01.06.2009 № 290н. об утверждении межотраслевых правил обеспечения работников специальной одеждой, специальной обувью и
548334	01 06 2009 290н г мзср приказ рф	приказ мзср рф от 01.06.2009 г. № 290н
548334	290н минздрав приказ	приказ минздрава № 290н
548334	290н пр	пр. 290н
548334	01 06 2009 290н 6 п пр	п. 6 пр № 290н от 01.06.2009
548334	01 06 2009 290н n минздравсоцразвитие приказ россия	приказ минздравсоцразвития россии от 01.06.2009 n 290н
548334	290н другой защита и индивидуальный межотраслевой минздравсоцразвитие обеспечение обувь одежда правило приказ работник рф специальный специальный средство утверждать	межотраслевых правил обеспечения работников специальной одеждой, специальной обуви и другими средствами индивидуальной защиты, утвержденных приказом минздравсоцразвития рф № 290н от
548334	все сизый	все о сиз
548334	1 2009 290н n год июнь приказ	приказ от 1 июня 2009 года n 290н
548334	1 2009 290н год июнь минздравсоцразвитие приказ россия	приказом минздравсоцразвития россии от 1 июня 2009 года № 290н
548334	01 06 2009 290н выдача межотраслевой правило спецодежда	межотраслевые правила выдачи спецодежды от 01.06.2009 № 290н
548334	290н каска постановление служба срок	постановление 290н срок службы каски
548334	одежда приказ специальный утверждение	приказ об утверждение специальной одежды
548334	01 09 2023г организовывать робот с с сизый	как организовать роботу с СИЗ с 01.09.2023г.?
548334	290н сизый	сиз 290н
548334	выдача новый организовывать правило сизый	как организовать выдачу СИЗ по новым правилам
549331	вести должный карточка кто предприятие сизый	кто должен вести карточки сиз на предприятии
549331	вести выдача карточка кто личный сизый	кто ведет личные карточки выдачи сиз
549331	вести выдача и карточка кто личный оформление спецодежда учет	кто ведет учет и оформление личных карточек выдачи спецодежды
549331	выдача заполнять карточка кто личный сизый учет	кто заполняет личную карточку учета выдачи сиз
549332	дежурный записывать карточка личный сизый	записывать дежурные сиз в личную карточку
549332	выдача дежурный журнал защита индивидуальный средство учет	Журнал учета выдачи дежурных средств индивидуальной защиты
549332	вписываться дежурная карточка ли сизый	дежурная сиз вписывается ли в карточку
549332	дежурный записываться карточка сизый	дежурные сиз в карточку записываются
549333	заполнение карточка личный ошибка	ошибки при заполнении личной карточки
549333	исправлять карточка ошибка сизый	как исправить ошибку в карточке сиз
549350	сертификат сизый читать	как читать сертификат сиз
549350	и новый сертификат сизый сравнение старый	новые и старые сертификаты на сиз сравнение
549350	какой сертификат сизый требоваться	на какие сиз требуется сертификат
549350	сертификат сизый союз таможенный тр	сертификат на сиз тр таможенного союза
548349	выдача кто осуществлять предприятие сизый	кто осуществляет выдачу сиз на предприятии
548349	выдача кто назначать ответственный сизый	кого назначить ответственным за выдачу сиз
548349	выдавать должный ли охрана специалист спецодежда труд	должен ли выдавать спецодежду специалист по охране труда?
549923	безопасность назначение образец ответственный паспорт приказ разработка	образец приказа о назначении ответственного за разработку паспорта безопасности
549923	безопасность назначение ответственный паспорт приказ разработка	приказ о назначении ответственного за разработку паспорта безопасности?
549011	выдача карточка личный смывать срок хранение	срок хранения личных карточек выдачи смывающих
549011	карточка сизый сколько храниться	сколько хранятся сиз карточки
549011	карточка личный сколько сос хранить	сколько хранить личную карточку сос
549011	вредный выдача и карточка кто опасный работать с сизый сколько труд условие хранить	сколько хранить карточки выдачи сиз кто работал с вредными и опасными условиями труда
549011	карточка сизый хранение	хранение карточек сиз
549011	выдача карточка сизый срок хранение	сроки хранения карточек выдачи сиз
549010	журнал карточка регистрация сизый учет	журнал учета регистрации карточек сиз
549010	выдача журнал карточка личный сизый учет	журнал учета выдачи личных карточек сиз
549012	выдача год заводить каждый карточка новый сизый	можно ли каждый год заводить новую карточку выдачи сиз
549014	вид карточка сизый электронный	карточка сиз в электронном виде
549014	вести вид выдача карточка личный сизый учет электронный	можно ли вести учет личных карточек выдачи СИЗ в электронном виде ?
549014	выдача карта сизый учет электронный	электронные карты учета выдачи сиз
548740	1 2023 безопасность год именно паспорт почему разрабатывать сентябрь	почему именно до 1 сентября 2023 года нужно разработать паспорт безопасности
548740	антитеррор безопасность паспорт	паспорта безопасности антитеррор
549611	2009г 22 357н июнь приказ	приказ 22 июня 2009г. № 357н
549611	357н n	n 357н
549611	06 2009 22 357н минздравсоцразвитие приказ	приказ минздравсоцразвития от 22.06.2009 № 357н.
548359	диэлектрический ковер размер	размеры диэлектрического ковры
548359	бот диэлектрический размер	размер диэлектрических бот
551252	003 12 2 91 безопасность безопасность гост оборудование общий производственный система ссбт стандарт требование труд	гост 12.2.003-91 система стандартов безопасности труда (ссбт). оборудование производственное. общие требования безопасности.
551252	003 12 2 91 гост	гост 12.2.003-91
551253	2020 45001 безопасность гост здоровье и и исо менеджмент охрана применение р руководство система требование труд	гост р исо 45001-2020 системы менеджмента безопасности труда и охраны здоровья. требования и руководство по применению
551253	2020 45001 гост исо применение р	гост р исо 45001-2020 применение
551254	0 010 12 2009 безопасность гост и опасность определение оценка р риск система стандарт труд	гост р 12.0.010-2009. система стандартов безопасности труда. определение опасностей и оценка рисков
551254	0 010 12 2009 безопасность гост р система ссбт стандарт труд	гост р 12.0.010-2009 система стандартов безопасности труда (ссбт).
551256	026 12 2015 4 безопасность гост знак и и и испытание метод назначение общий правило применение разметка сигнальный сигнальный ссбт технический требование характеристика цвет	гост 12.4.026-2015. ссбт цвета сигнальные, знаки безопасности и разметка сигнальная. назначение и правила применения. общие технические требования и характеристики. методы испытаний
551256	026 12 2015 4 безопасность безопасность гост знак и и и назначение общий правило применение разметка сигнальный сигнальный система стандарт технический требование труд характеристика цвет	гост 12.4.026-2015 система стандартов безопасности труда. цвета сигнальные, знаки безопасности и разметка сигнальная. назначение и правила применения. общие технические требования и характеристики.
551256	026 12 2001 4 гост р сигнальный цвет	гост р 12.4.026-2001 цвета сигнальные
551256	гост знак предупредительный	знаки предупредительные гост
551256	2015 гост сигнальный цвет	гост 2015 цвета сигнальные
551256	026 12 2 2015 4 гост л табла	гост 12.4.026-2015 табл. л,2
550075	контроль опо осуществление план производственный работа	план работы по осуществлению производственного контроля опо
550075	контроль опэо организовывать производственный	как организовать производственный контроль на опэо?
551359	выдавать достаточно заведение или ли обязанный охрана протокол труд удостоверение учебный	обязано ли учебное заведение выдавать удостоверений по охране труда или достаточно протокола
551359	выдавать завершение корочка ли обучение охрана сейчас труд	Выдают ли сейчас корочки по завершению обучения по охране труда?
551359	заполнение охрана труд удостоверение форма	форма заполнения удостоверения по охране труда
551359	выдавать ли охрана сейчас труд удостоверение	выдают ли сейчас удостоверение по охране труда
551359	знание охрана проверка труд удостоверение	удостоверение о проверке знаний охраны труда
551359	выдача охрана правило работник труд удостоверение	правила выдачи удостоверений по охране труда работникам
551359	1 выдавать действовать ли охрана ранее сентябрь труд удостоверение	действуют ли удостоверения по охране труда выданные ранее 1 сентября
