TemplateID	LmQuery	Query
397658	вакцина инфекция ковивак коронавирусный новый применение против сопа	соп по применению вакцины ковивак против новой коронавирусной инфекции
397626	кабинет процедурный	процедурный кабинет
397626	кабинет оборудование процедурный санпин согласно	оборудование процедурного кабинета согласно санпину
397804	вид внешний основа пищеблок пищевой санитария требование	основы пищевой санитарии на пищеблоке.требования к внешнему виду
397804	пищеблок работа	работа пищеблока
397804	больничный гигиенический пищеблок требование	гигиенические требования к больничным пищеблокам
397804	буфетная и пищеблок порядок	порядок в буфетной и на пищеблоке
397804	лпу оснащение отделение раздаточный	оснащение раздаточной в отделениях лпу
399060	внутренний и контроль лист ошибка санэпидрежим чек	ошибки в санэпидрежиме и чек-листы для внутреннего контроля
399060	лист чек эпид	чек-лист эпид
399060	во время ежедневный контроль лист пандемия чек эпидбезопасность	чек-листы для+ежедневного+контроля+эпидбезопасности+во+время+пандемии
399060	главный контроль лист медсестра санэпидрежим чек	чек-лист главной медсестры по контролю санэпидрежима
399060	лист режим чек эпид	эпид режим чек-лист
399060	лист оснащение палата чек	чек-лист оснащения палат
399060	лист лпу обход чек	чек-лист обходов в лпу
397792	внутрибольничный пневмония	Внутрибольничная пневмония
397792	выявлять пациент пневмония стационар	у пациента в стационаре выявили пневмонию
398882	наставничество организация приказ	приказ об организации наставничества
398882	врач назначение наставник приказ стажер	приказ на назначение наставника врачу-стажеру
399657	какой лпу мз приказ приказ сопа утверждать	каким приказом утверждены соп в лпу № приказа мз
399657	внедрять ли обязательно сопа	обязательно ли внедрять сопы
399657	зачем разрабатывать сопа	зачем разрабатывать сопы
399657	весь кабинет неврологический сопа	все сопы неврологического кабинета
399657	документ какой оформлять прописывать сопа	в каком документе прописано что нужно оформлять соп
399657	больница быть должный какой сопа туберкулезная	какие сопы должны быть в туберкулезной больнице
399657	мед организация сопа	сопы в мед организации
399661	внедрять и лекарство разрабатывать сопа	как разработать и внедрить сопы по лекарствам
399661	внедрение сопа	внедрение сопы
399661	внедрять главный и медсестра разрабатывать сопа	как внедрить и разработать сопы главной медсестре
399477	вакцина ответственный побочный приказ эффект	приказ об ответственным за побочные эффекты вакцины
399477	вакцинация ответственный приказ	приказ об ответственном за вакцинацию
400041	контроль поликлиника приказ радиационный	приказ по радиационному контролю в поликлинике
400041	поликлиника приказ радиационный	приказ по радиационному поликлиника
400041	d контроль поликлиника приказ радиационный	приказ по радиационному контролю d поликлинике
400640	аэропорт больница воздействие вокзал гражданин дым заведение закон закреплять запрет здоровье и и курение образовательный окружающее охрана поезд поликлиника табачный я	я запрет курения в больницах, поликлиниках, образовательных заведениях, аэропортах, на вокзалах и поездах закреплен в законе об охране здоровья граждан от воздействия окружающего табачного дыма и
400640	запрет курение приказ	приказ о запрете курения
400640	акция борьба курение мероприятие приказ проведение профилактический с	приказ о проведении профилактических мероприятий акции по борьбе с курением
400640	борьба курение с	борьба с курением
400905	медикамент приказ работа с	приказ по работе с медикаментами
400905	аптека лекарственный медсестра получение препарат приказ старший	приказ о получении лекарственных препаратов старшей медсестрой из аптеки
400905	государственный контроль лекарственный надзор обращение постановление правительство рф средство сфера федеральный	постановлением правительства рф о федеральном государственном контроле (надзоре) в сфере обращения лекарственных средств
400905	лекарственный мо обращение порядок приказ проект с средство	проект приказа о порядке обращения с лекарственными средствами в мо
400905	действующий и лекарство нет приказ	приказы по лекарствам действующие и нет
400905	лекарственный обесп приказ	приказ о лекарственном обесп
400905	лс приказ	приказы по лс
400905	лекарственный обращение порядок приказ средство	приказ о порядке обращения лекарственных средств
400905	лекарственный льготный обеспечение поликлиника приказ	приказ льготное лекарственное обеспечение в поликлинике
401031	идентификация медорганизация приказ	приказ медорганизации идентификация
401031	идентификация приказ	идентификация приказ
401031	главврач идентификация приказ	приказ главврача идентификация
401031	идентификация локальный пациент приказ	локальные приказы по идентификации пациента
401629	вакцина вакцинация и ковивак проведение процедура сопа эпиваккорона	"СОП «Проведение процедуры вакцинации вакцинами ""ЭпиВакКорона"" и ""КовиВАК""»"
401629	вакцинация и ковивак проведение процедура сопа эпиваккорона	"СОП «Проведение процедуры вакцинации ""ЭпиВакКорона"" и ""КовиВАК""»"
401367	госпитализация сопа	СОП госпитализация
401367	алгоритм госпитализация пациент экстренный	алгоритм для экстренной госпитализации пациентов
401367	алгоритм госпитализация действие медицинский пациент с сотрудник степень тяжелый тяжесть	алгоритм действий медицинских сотрудников по госпитализации пациентов с тяжелой степенью тяжести
401366	выписка сопа	СОП выписка
401366	выписка новорожденный отделение педиатрический ребенок сопа	СОП «Выписка детей из педиатрического отделения для новорожденных»
401366	выписка новорожденный сопа	СОП новорожденные выписка
401363	лечение реакция сопа трансфузионный	СОП «Лечение трансфузионных реакций»
401363	сопа трансфузия	соп трансфузия
401363	реакция сопа трансфузионный	СОП трансфузионная реакция
401364	кабинет катамнез порядок работа сопа	СОП «Порядок работы кабинета катамнеза»
401364	катамнез сопа	соп катамнез
401364	кабинет катамнез сопа	СОП кабинет катамнеза
401365	новорожденный отделение порядок прием ребенок сопа	СОП «Порядок приема ребенка в отделение новорожденных»
401365	новорожденный сопа	сопы для новорожденных
401365	новорожденный отделение сопа	СОП отделение новорожденных
401368	госпитализация действие медперсонал отказ пациент порядок сопа	СОП «Порядок действий медперсонала при отказе пациента от госпитализации»
401368	госпитализация отказ сопа	СОП госпитализация отказ
401369	значение исследование критический лабораторный передача сопа	СОП «Передача критических значений лабораторных исследований»
401369	диагностический критический показатель служба	критические показатели для диагностических служб
401370	кровь сопа требование хранение	СОП требование к хранению крови
401370	венозный и исследование кровь лабораторный проба сопа транспортировка требование условие хранение	СОП «Требования к условиям хранения и транспортировки проб венозной крови для лабораторных исследований»
401371	вакцина вакцина вакцинация грипп и лайт одновременный против сопа спутник	"СОП одновременная вакцинация вакциной ""Спутник Лайт"" и вакциной против гриппа"
401371	алгоритм лайт прививка проведение сопа спутник	соп алгоритм проведения прививки спутник лайт
401371	лайт сопа спутник	соп спутник лайт
401371	вакцина лайт сопа спутник	соп по вакцине спутник лайт
401838	год календарь национальный план прививка прививка профилактический профилактический рамка	План профилактических прививок в рамках национального календаря профилактических прививок на год
401838	год план прививка профилактический	План профилактических прививок на год
401839	19 covid вакцинация отчет	Отчет о вакцинации от COVID-19
401839	вакцинация отчет	отчет по вакцинации
401839	вакцинация ковид отчет	отчет о вакцинации ковид
401840	19 covid вакцинация взрослый кабинет контроль лист население порядок прививочный проведение против сопа чек	Чек-лист контроля СОП «Порядок проведения вакцинации против COVID-19 взрослому населению» в прививочном кабинете
401840	вакцинация контроль лист порядок проведение чек	Чек-лист контроля Порядок проведения вакцинации
401841	двухкомпонентный журнал прививка профилактический учет	Журнала учета двухкомпонентных профилактических прививок
401841	вак вак гам двухкомпонентный журнал кови ковид корона прививка профилактический учет эпивак	Журнала учета двухкомпонентных профилактических прививок Гам-Ковид-Вак, Эпивак-Корона, Кови-Вак
401841	вак гам двухкомпонентный журнал ковид корона прививка профилактический учет эпивак	Журнала учета двухкомпонентных профилактических прививок Гам-Ковид-Вак, Эпивак-Корона
401842	емкость инструментарий использование контейнер острый сбор сопа	СОП «Использование емкости-контейнера для сбора острого инструментария»
401842	инструментарий использование контейнер острый сбор сопа	СОП Использование контейнера для сбора острого инструментария
401842	инструментарий контейнер сбор сопа	СОП контейнера для сбора инструментария
401843	стоматология хирургический	хирургическая стоматология
401843	накрытие операционный стол стоматология	накрытие операционного стола в стоматологии
401436	медорганизация назначение ответственный приказ работа эпидемиологический	Приказ о назначении ответственных за эпидемиологическую работу в медорганизации
401436	медорганизация ответственный приказ работа эпидемиологический	Приказ об ответственных за эпидемиологическую работу в медорганизации
401833	врач должностной инструкция оториноларинголог	должностная инструкция врача оториноларинголога
401833	должностной инструкция лор	должностная инструкция ЛОР
401833	должностной инструкция отоларинголог	должностная инструкция отоларинголога
401833	врач должностной инструкция лора	должностная инструкция врача ЛОРа
401835	вакцинация выполнение записка не отвечать план служебный	как ответить на служебную записку по не выполнению плана вакцинации
401835	вакцинация лпу план сотрудник	план вакцинации сотрудников лпу
401835	вакцинация инфекция коронавирусный новый план	план по вакцинации от новой коронавирусной инфекции
404105	врачебный запрет пациент разглашение тайна	Запрет пациента на разглашение врачебной тайны
404105	врачебный запрет разглашение тайна	Запрет на разглашение врачебной тайны
21292	исследование рентгенологический сопа	соп рентгенологические исследования
21292	кабинет оснащение рентген сопа	соп оснащения рентген кабинета
404618	дезинфекция заключительный кабинет перевязочный показание сопа эпидемиологический	СОП «Заключительная дезинфекция по эпидемиологическим показаниям в перевязочном кабинете»
404618	дезинфекция заключительный кабинет перевязочный сопа	СОП «Заключительная дезинфекция  в перевязочном кабинете»
404618	дезинфекция заключительный показание сопа эпидемиологический	"СОП «Заключительная дезинфекция по эпидемиологическим показаниям"""
404598	демеркуризация разбитый ртутный ртуть с сопа термометр	СОП «Демеркуризация ртути с разбитого ртутного термометра»
404598	ртуть сопа	СОП ртуть
404598	демеркуризация ртуть сопа	СОП Демеркуризация ртути
404610	генеральный кабинет перевязочный проведение сопа уборка	СОП «Проведение генеральной уборки в перевязочном кабинете»
404610	генеральный кабинет перевязочный сопа уборка	СОП генеральная уборка в перевязочном кабинете
404610	генеральный перевязочная сопа уборка	СОП генеральная уборка в перевязочной
405245	отделение положение приемный	положение приемное отделение
405245	деятельность организация отделение положение приемный	положение об организации деятельности приемного отделения
406084	инициировать медицинский медучреждение обращение отход проверка прокуратура с	Прокуратура инициирует проверку обращения с медицинскими отходами в медучреждении
406084	и медотход проверка прокуратура	Прокуратура и проверка по медотходами
406084	медотходы проверка прокуратура	Прокуратура проверка медотходов
405984	водитель обязательный освидетельствование положение порядок проведение	положение о порядке проведения обязательного освидетельствования водителей
405984	медосмотр положение предрейсовый	положение о предрейсовых медосмотрах
405984	автотранспортный водитель и медицинский обязательный организация осмотр положение порядок предрейсовый проведение средство	положение о порядке организации и проведения обязательных предрейсовых медицинских осмотров водителей автотранспортных средств
405984	лпу медосмотр предрейсовый приказ шаблон	приказ по предрейсовым медосмотрам в лпу шаблон
22318	вне инструкция маршрутизация мо пациент	инструкция по маршрутизации пациента вне мо
22318	и маршрутизация медпомощь оказание поликлиника преемственность	Преемственность и маршрутизация оказания медпомощи в поликлинике
22318	амбулаторный помощь сопа	соп по амбулаторной помощи
406170	инициировать какой медицинский медучреждение обращение отход проверка прокуратура с случай	в каких случаях прокуратура инициирует проверку обращения с медицинскими отходами в медучреждении
406170	антикоррупция проверка прокуратура	антикоррупция проверка прокуратуры
431726	мо приказ сопа	приказ по сопам в мо
431726	введение действие приказ сопа	приказ о введении в действие сопа
431726	приказ работа с сопа	приказ для работы с соп
431726	нормативный сопа ссылка	нормативные ссылки к сопам
431726	врач главный написание образец правило приказ сопа	образец приказа главного врача о правилах написания соп
431726	введение оперативный приказ стандартный	приказ по введению стандартных оперативных
431726	безопасность лекарственный направление приказ создание соп	приказы о создании сопов по направлению лекарственная безопасность
431726	положение разработка сопа	положение о разработке соп
432471	2020 быть весть год граф грубый журнал запись и и нс нумеровать оборот образец операция ошибка пв правильно регистрация с связывать считаться	образец журнала регистрации операций, связанных с оборотом нс и пв на 2020 год как вести записи, правильно нумеровать графы и что будет считаться грубой ошибкой?
432471	2020 журнал и нс пв учет	журнал учета нс и пв на 2020
432471	2022 журнал наркотический средство	наркотические средства журнал 2022
432471	01 03 2022 журнал и нс пв с форма	форма журнала по нс и пв с 01,03,2022
432471	журнал новый образец препарат психотропный	образец нового журнала по психотропным препаратам
432471	2117 журнал нспв оборот операция приказ регистрация с связывать	журнал регистрации операций, связанных с оборотом нспв приказ № 2117
432471	журнал и нс	журнал нс и в
