TemplateID	LmQuery	Query
36577	договор документация рабочий разработка	договор на разработку рабочей документации
36577	авторский договор надзор подряд псд разработка с	договор подряда на разработку псд с авторским надзором
404083	воздействие должный кто негативный окружающий платить среда	кто должен платить за негативное воздействие на окружающую среду
404083	кто нвос платить	кто платит нвос
430982	гибдд действие обжалование	обжалование действий гибдд
430982	обжаловать штраф	обжаловать штраф
430982	нарушение обжаловать пдд постановление	как обжаловать постановление о нарушении пдд
541959	2 оп отходы сдавать тп	как сдавать 2-тп отходы в оп
541959	2 а каждый лицо не отходы отчет подавать подразделение тп целое юр	можно ли подавать отчет 2-ТП отходы в целом по ЮР лицу, а не по каждому подразделению
541959	2 обособденный отходы подразделение сдавать тп	как сдавать 2-тп отходы в обособденных подразделениях
430978	административный дело обжаловать постановление правонарушение	как обжаловать постановление по делу об административном правонарушении
430978	административный обжаловать общий орган ответственность постановление привлечение суд юрисдикция	как обжаловать в суде общей юрисдикции постановление административного органа о привлечении к ответственности
542067	жбо относить	Что относят к ЖБО
542067	жбо код фкко	Коды ФККО для ЖБО
573333	2 отходы сдавать тп форма	как сдать форму 2-тп отходы?
573333	2 малый отходы предприятие тп	2-тп отходы малые предприятия
573333	2 образование отходы отходы рассчитать тп	как рассчитать образование отходов для 2-тп отходов
573333	2 доверенность образец отходы росприроднадзор сдача тп	образец доверенности в росприроднадзор по сдаче 2-тп-отходы
573333	2 бытовой год норма отходы офисный расход тп	2-тп отходы норма бытовых офисных расходов в год
436339	2022 водный квартал коэффициент налог первый	коэффициент по водному налогу на первый квартал 2022
436339	2022 2025 водный налог ставка	водный налог ставки 2022-2025
436339	водный край краснодарский налог ставка	ставка водного налога в краснодарском крае
436339	2022 водный и коэффициент налог ставка	ставка водного налога на 2022 и коэффициенты
436339	водный коэффициент налог население повышать ставка	водный налог ставки для населения повышающий коэффициент
436339	водный крым налог	водный налог в крыму
436339	без водный лицензия налог ставка	ставка водного налога без лицензии
436339	10 водный коэффициент налог	водный налог коэффициент 10
436339	водный ли меняться налог ставка	менялись ли ставка на водный налог
436339	2022 архангельский водный год налог область ставка	ставка водный налог на 2022 год Архангельская область
536830	гоу тип	типы гоу
536830	вид газоочистный установка	виды газоочистных установок
442101	контроль отчет производственный экологический	Отчет о производственном экологическом контроле
442101	отчет пэк	отчет пэк
479096	вид здание земельный использование использоваться не участок	здания не используются по виду использования земельного участка
479096	вид застройка землепользование и использование отличаться правило разрешать	вид разрешенного использования отличается от правил землепользования и застройки
479096	вид земельный использование не объект разрешать соответствовать участок	вид разрешенного использования земельного участка не соответствует объекту
542140	акт консервация	акт консервации
542140	консервация объект	консервация объекта
534521	и инвентаризация отход потребление производство	инвентаризация отходов производства и потребления
534521	1 инструкция класс обращение отход с	инструкции обращение с отходами 1 класса
483450	4 категория нвос	4 категория нвос
483450	категория нвос	категории нвос
483450	3 выброс документ какой категория нвос плата предприятие рассчитать расчет	по какому документу рассчитать выбросы для 3 категории предприятия при расчете платы за НВОС
483450	iv весь вносить категория который нвос объект относиться плата тот тот число	плату за НВОС нужно вносить по всем объектам, в том числе по тем, которые относятся к iv категории
491350	v класс лицензия отходы	лицензия v класс отходы
491350	5 класс лицензия отходы	отходы 5 класс лицензия
543522	2023 изменение октябрь экология	Изменения по экологии в октябре 2023
543522	2023 изменение июль	Изменения в июле 2023
543522	2023 новый норма экология	Новые нормы в экологии 2023
543522	2023 изменение	Изменение 2023
543522	2023 год законодательство изменение экологический	Изменения в экологическом законодательстве в 2023 году
516631	задание технический	техническое задание
516631	техзадание	техзадание
516631	тз	тз
517290	административный заявление куда обжалование ответственность подавать постановление привлечение	куда подавать заявление об обжаловании постановления о привлечении к административной ответственности
517290	административный арбитражный вид обжалование ответственность привлечение решение суд штраф	обжалование решения о привлечении к административной ответственности в виде штрафа в арбитражном суде
520020	ведение журнал и отходы потребление производство учет	журнал ведения учета отходов потребления и производства
520020	ведение журнал и отходы подразделение потребление производство учет	журнал ведения учета отходов потребления и производства в подразделениях
520020	вести отходы предприятие учет	Как вести учет отходов на предприятии
519905	административный гибдд жалоба ответственность постановление привлечение суд	жалоба в суд на постановление о привлечении к административной ответственности гибдд
519905	административный апелляция гибдд ответственность постановление привлечение суд	апелляция в суд на постановление о привлечении к административной ответственности гибдд
524938	заявление класс опасность подтверждение прикладывать	что приложить к заявлению на подтверждение класса опасности
524938	документ какой класс опасность отход подтверждение	какие документы нужны для подтверждения класса опасности отхода
524408	административный обжалование ответственность постановление привлечение	обжалование постановления о привлечении к административной ответственности
524408	административный обжаловать ответственность постановление привлечение	обжаловать постановления о привлечении к административной ответственности
524842	декларация кабинет нвос природопользователь	декларация нвос кабинет природопользователя
524842	воздействие декларация заполнение окружающий пример среда	декларация о воздействии на окружающую среду пример заполнения
524842	декларация заполнять кабинет личный нвос оплата	Как правильно заполнять декларацию по оплате нвос в личном кабинете
524842	декларация надо нвос плата прикладывать	декларация о плате за нвос что надо прикладывать
528038	п	п
528039	и	и
529542	вести отходы учет	как вести учет отходов
529542	ведение внутри журнал и отходы потребление предприятие производство учет	журнал ведения учета отходов потребления и производства внутри предприятия
529540	ведение журнал и отходы потребление производство учет	журнал ведения учета отходов потребления и производства
529540	отходы учет	учет отходов
532037	обращение ответственный отход приказ с	приказ об ответственных за обращение с отходами
532037	ответственный отходы приказ учет	приказ об ответственных за учет отходов
532037	ведение журнал ответственный отходы приказ	приказ об ответственных за ведение журнала отходов
549607	документ разработка экология	разработка документов по экологии
549607	проект разрабатывать экологический	как разработать экологические проекты
549608	календарь проф	проф календарь
549608	календарь пользоваться эколог	как пользоваться календарем эколога
532104	мероприятие пан проверка росприроднадзор составлять	как составить пан мероприятий перед проверкой росприроднадзора
532104	подготавливаться проверка	как подготовиться к проверке
532104	мероприятие пан проверка составлять	как составить пан мероприятий перед проверкой
534080	платежный поручение сбор уплата экологический	экологический сбор уплата платежное поручение
534080	реквизит сбор уплата экологический	реквизиты для уплаты экологического сбора
534080	2023 оплата реквизит сбор экологический	реквизиты по оплате экологического сбора 2023
534080	2023 образец платежный поручение сбор экологический	образец платежного поручения экологический сбор за 2023
534080	оплачивать экосбор	как оплатить экосбор
532085	деятельность лицензия обращение отход с	лицензия на деятельность по обращению с отходами
532085	12 2020 2290 26 постановление правительство	постановление Правительства от 26.12.2020 № 2290
532129	жалоба какой подавать суд штраф	в какой суд подавать жалобу на штраф
532129	какой коап обжаловать суд штраф	В какой суд обжаловать штраф по КоАП
534399	инструкция медицинский обращение отход с	инструкция по обращению с медицинскими отходами
534399	медицинский обращение отход с схема	схема обращения с медицинскими отходами
534399	медицинский обращаться отход с	как обращаться с медицинскими отходами
534581	инструкция медицинский обращение отход с	инструкция по обращению с медицинскими отходами
534581	1 4 кл медицинский опасность отход отходы	медицинские отходы отходы 1-4 кл опасности
534081	переплата экосбор	переплата экосбор
534081	вернуть сбор экологический	как вернуть экологический сбор
534520	3 инвентаризация категория нвос объект отходы	инвентаризацию отходов на объекте нвос 3 категории
534520	инвентаризация отходы проводить	как провести инвентаризацию отходов
537101	2023 год платить сбор экологический	экологический сбор как платить в 2023 году
537101	посчитать сбор экологический	как посчитать экологический сбор
537101	сбор утилизационный экологический	утилизационный экологический сбор
537101	льгота отмена сбор экологический	отмена льготы по экологическому сбору
537101	вывоз отходы полигон сбор экологический	экологический сбор вывоз отходов полигон
537101	контейнер сбор экологический	экологический сбор за контейнеры
537101	сбор топливо экологический	экологический сбор за топливо
537101	деревянный изделие производство сбор экологический	производство деревянных изделий экологический сбор
537113	несвоевременный оплата сбор штраф экологический	штраф за несвоевременная оплата экологического сбора
537113	неуплата сбор штраф экологический	штрафы за неуплату экологического сбора
537112	23 год норматив сбор ставка утилизация экологический	норматив утилизации ставка экологического сбора на 23 год
537112	импортер сбор ставка тара экологический	ставка экологического сбора для импортеров тара
537112	норматив плата ставка утилизация	ставки платы норматива утилизации
537109	расчет сбор форма экологический	форма расчета экологического сбора
537109	2023 и расчет сбор уплата экологический	экологический сбор за 2023 расчет и уплата
537109	расчет сбор экологический	расчет экологического сбора
537109	впервые расчет сбор сдаваться экологический	расчет экологического сбора сдается впервые
537109	налог прибыль расчет сбор учитывать экологический	как при расчете налога на прибыль учесть экологический сбор
537110	декларация заполнение сбор экологический	заполнение декларации по экологическому сбору
537110	отчетность сбор экологический	отчетность по экологическому сбору
537106	2023 сбор уплата экологический	экологический сбор уплата в 2023
537106	и кто отчетность платить сбор сдавать утилизация экологический	кто платит экологический сбор и сдает отчетность об утилизации
537106	сбор экологический	экологический сбор
537108	когда сбор сдавать экологический	когда сдавать экологический сбор
537108	2023 год сбор срок уплата экологический	срок уплаты экологического сбора в 2023 году
537108	оплата сбор срок экологический	срок оплаты экологического сбора
537108	начисление с сбор срок упаковка экологический	срок начисления экологического сбора с упаковки
537108	сбор срок уплата экологический	сроки уплаты экологического сбора
537108	отчет расчет сбор срок экологический	срок отчета расчет экологического сбора
537108	2022 сбор срок уплата экологический	срок уплаты экологического сбора за 2022
536826	газоочистный установка	газоочистные установки
536826	гоу осмотр периодичность технический	периодичность технического осмотра ГОУ
536827	гоу паспорт	паспорт ГОУ
536827	газоочистной паспорт установка	паспорт газоочистной установки
536828	гоу эффективность	эффективность ГОУ
536828	гоу работа эффективность	эффективность работы ГОУ
536908	компания отчетность экологический	экологическая отчетность компании
536908	должный какой компания отчетность росприроднадзор сдавать	какую отчетность компании должны сдавать в Росприроднадзор
538534	место накопление отходы требование	требования к месту накопления отходов
538534	временный и место накопление организация отходы производственный хранение	по организации мест временного хранения и накопления производственных отходов
538534	правило тбо хранение	правила хранения тбо
538534	мно требование	требования к МНО
538544	коммунальный обращение отход с твердый	обращение с твердыми коммунальными отходами
538544	обращение отход с	обращение с отходами
538547	вывоз тбо	вывоз ТБО
538547	вывоз коммунальный отходы твердый	вывоз твердых коммунальных отходов
538068	когда обучение проходить	когда проходить обучение
538068	обучение экология	обучение по экологии
538068	безопасность и кто обеспечение обучение общехозяйственный руководитель система специалист тема управление экологический	кому необходимо обучение по теме: обеспечение экологической безопасности руководителями и специалистами общехозяйственных систем управления
538068	когда обращение обучение отход проходить с	когда проходить обучение по обращению с отходами
538071	обучение проходить часто	как часто проходить обучение
538071	обучение периодичность экология	периодичность обучения по экологии
538290	входить обучение экология	что входит в обучение по экологии
538290	выдавать документ какой обучение после	какой документ выдают после обучения
538290	документ какой подготовка подтверждать экология	какой документ подтверждает подготовку по экологии
538249	водопользование плата россия	плата за водопользование в россии
538249	водопользование налоговый плата учет	плата за водопользование налоговой учет
538249	водопользование плата применяться усна	плата за водопользования в усн применяется
538249	вещество водопользование договор загрязнять норма плата сброс сверх	договор водопользования плата за сброс загрязняющих веществ сверх нормы
538548	объем посчитать тко	Как посчитать объем ТКО
538548	бытовой объем отходы посчитать твердый	Как посчитать объем твердых бытовых отходов
538549	обращение оператор определять отход региональный с	Как определить регионального оператора по обращению с отходами
