TemplateID	LmQuery	Query
538549	оператор определять региональный тко	Как определить регионального оператора ТКО
538549	вывоз оператор отходы региональный тко	Региональный оператор по вывозу отходов ТКО
539273	отходы паспорт утверждать	как утвердить паспорт отходов
539273	отход паспорт	паспорта отходов
539281	грозить отсутствие отход паспорт	Что грозит за отсутствие паспорта на отход
539281	отсутствие отходы паспорт штраф	штраф за отсутствие паспортов на отходы
539282	5 класс опасность отходы	5 класс опасности отходов
539282	5 класс опасность отходы паспорт	паспорт на 5 класс опасности отходов
539282	5 вывоз класс ли мусор отходы паспорт площадка со строй	Нужен ли паспорт на вывоз мусора со строй площадки на 5 класс отходов
538996	лампа ртутьсодержащий	ртутьсодержащие лампы
538996	отходы ртутьсодержащий	ртутьсодержащие отходы
539042	2 отходы отчет тп форма	отчет по форме 2-тп отходы
539042	2 jls jn ng	2 ng jn[jls
539042	2 отходы тп	2 тп отходы
539043	2 не ответственность отходы сдача тп	ответственность за не сдачу 2-тп отходы
539043	2 не отходы подача тп штраф	штрафы за не подачу 2-тп отходы
539043	2 отходы тп штраф	штраф 2-тп отходы
539044	2 отходы тп	2-тп отходы
539044	2 отходы подача срок тп	срок подачи 2-тп отходы
539044	2 вид какой отходы подавать тп	в каком виде подавать 2-тп отходы
539683	выброс источник организованный	организованный источник выбросов
539683	источник какой организованный относить	какие источники относят к организованным
539684	выброс источник площадной	площадной источник выброса
539684	выброс источник относить площадной	как источники выбросов относят к площадным
539685	выброс источник неорганизованный	неорганизованный источник выбросов
539685	источник какой неорганизованный относить	какие источники относят к неорганизованным
539687	выброс источник линейный	линейный источник выброса
539687	выброс источник линейный относить	как источники выбросов относят к линейным
539688	выброс источник линейный	линейный источник выброса
539688	выброс источник линейный относить	как источники выбросов относят к линейным
539583	газ отчет парниковый сдавать	отчет по парниковым газам как сдать
539583	газ какой отчет парниковый сайт сдавать	через какой сайт сдать отчет о парниковых газах
539585	газ отчет парниковый	отчет о парниковых газах
539586	02 07 2021 296 закон кто отчет сдавать федеральный фз	кто сдает отчет по федеральному закону от 02.07.2021 № 296-ФЗ
539586	выброс газ кто отчет парниковый сдавать	кому нужно сдать отчет о выбросах парниковых газов
539586	газ парниковый	парниковые газы
539589	газ методика парниковый расчет	методика расчетов парниковых газов
539589	газ инвентаризация парниковый	Инвентаризация парниковых газов
539589	газ какой методика парниковый рассчитать	по какой методике рассчитать парниковые газы
539649	должный кто объект ставить учет	кто должен ставить объект на учет
539649	кто объект ставить учет	кому нужно ставить объект на учет
539649	нвос объект являться	что является объектом нвос
539251	отход паспорт	паспорт на отход
539251	отходы паспорт	паспорт отходов
539251	i iv класс опасность отход паспорт	паспорт отхода i - iv класса опасности
539090	пноолр	пноолр
539090	и их лимит норматив образование отходы размещение	нормативы образования отходов и лимитов на их размещение
539092	пноолр	пноолр
539092	лимит отходы оформлять	Как оформить лимиты на отходы
539092	бланк лимит отходы	бланк лимитов отходов
539694	государственный нвос объект постановка учет	постановка на государственный учет объекта нвос
539694	бумажный вид заявка подавать постановка учет	как подать заявку о постановке на учет в бумажном виде
539656	государственный заявление нвос объект постановка учет форма	форма заявления о постановке на государственный учет объекта нвос
539656	заполнять заявление какой постановка учет форма	по какой форме заполнять заявление о постановке на учет
541827	предприятие приказ пэк утверждение	приказ об утверждении пэк на предприятии
541827	организация приказоб производственный экоконтроль	приказоб организации производственного экоконтроля
541827	приказ пэк форма	Форма приказа ПЭК
540295	экозос	экозос
540295	заключение итог капстроительство росприроднадзор	заключение Росприроднадзора по итогам капстроительства
540296	мероприятие план подготовка проверка росприроднадзор	План мероприятий по подготовке к проверке Росприроднадзора
540296	мероприятие пан проверка росприроднадзор составлять	как составить пан мероприятий перед проверкой росприроднадзора
540296	мероприятие план проверка росприроднадзор сделать	Как сделать план мероприятий к проверке росприроднадзора
540647	2 инвентаризация категория объект отходы	инвентаризация отходов на объекте 2 категории
540647	инвентаризация какой отходы предприятие	инвентаризация отходов каким предприятиям нужно
540647	3 инвентаризация категория нвос объект отходы	инвентаризацию отходов на объекте нвос 3 категории
540649	инвентаризация когда отходы проводить	когда проводить инвентаризацию отходов
540649	внеплановый инвентаризация отходы	внеплановая инвентаризация отходов
541737	ли ноутбук обязанный организация сломать списывать утилизировать	обязана ли организация утилизировать списанный сломанный ноутбук?
541737	запрещать захоронение отходы перечень	перечень запрещенные к захоронению отходы
541743	1 изменяться с январь	Что изменилось с 1 января
541743	законодательство изменение	изменения законодательства
541746	декларация куда нвос подавать	куда подавать декларацию нвос
541746	декларация объект разный регион сдавать сколько	сколько деклараций сдать если объекты в разных регионах
541746	декларация сдавать сколько	сколько деклараций сдать
542056	норматив решение сброс	Нормативы сбросов для Решения
542056	допустимый норматив проект сброс	Проект нормативов допустимых сбросов
542057	вода декларация разрабатывать сточный	Как разработать декларацию сточных вод
542057	вода декларация и свойство состав сточный	Декларация о составе и свойствах сточных вод
541987	и и ликвидация мероприятие нефтепродукт нефть план предупреждение розлив	план мероприятий по предупреждению и ликвидации розлива нефти и нефтепродуктов
541987	и нефтепродукт нефть разлив	разлив нефти и нефтепродуктов
541987	плрн утверждать	как утвердить плрн
541992	изменение штраф	изменения в штрафах
541992	штраф экология	штрафы по экологии
541994	быть документ сброс	Документы, если есть сбросы
541994	сброс	Сбросы
541559	быть документ должный какой организация экология	какие документы по экологии должны быть в организации
541559	акт локальный нормативный перечень экология	перечень локальных нормативных актов по экологии
541559	обязанность окружающий организация основной охрана среда	основные обязанности организаций по охране окружающей среды
541791	заполнение образец экосбор	образец заполнения экосбора
541791	отчет сбор форма экологический	форма отчета об экологическом сборе
541967	медицинский отход	медицинские отходы
541967	медицинский обращение отход с	обращение с медицинскими отходами
541967	мед обращение организовывать отходы с	как организовать обращение с мед отходами
541970	а класс медицинский отход учитывать	как учитывать медицинские отходы класса А
541970	медицинский отходы учет	учет медицинских отходов
543644	неустановленный санкция створ	Санкции за неустановленные створы
543644	быть и контрольный не створ устанавливать фоновый	Что будет, если не установить контрольный и фоновый створы
543644	наказывать не створ устанавливать	Как накажут, если створы не установить
543644	отсутствие створ фоновый штраф	Штрафы за отсутствие фонового створа
541609	обучение периодичность	периодичность обучения
541609	инструктаж проводить часто	как часто проводить инструктажи
541816	какой относить отход отход побочный побочный продукт продуктамикакий производство считаться	какие отходы считаются побочными продуктамикакие отходы относят к побочным продуктам производства
541816	относить побочный продукт производство	что относят к побочным продуктам производства
541816	отходы побочный продукт являться	что является отходами что побочными продуктами
541973	класс медицинский отходы требование	требования к медицинским отходам класса В
541973	класс медицинский отход	медицинские отходы класс В
541984	выброс закон квотирование	закон о квотировании выбросов
541984	квотировать объект	квотируемые объекты
541753	декларация должный кто нвос подавать	кто должен подавать декларацию нвос
541753	деларация кто нвос сдавать	кто сдает деларацию нвос
541753	декларация кто надо нвос сдавать	кому надо сдать декларацию нвос
541754	декларация когда нвос сдавать	когда сдавать декларация нвос
541754	декларация нвос плата	декларация о плате за нвос
541931	договор заключать с фэо	как заключить договор с фэо
541931	1 класс отходы утилизация	утилизация отходов 1 класса
541932	документ какой отчет прилагаться пэк	отчет пэк какие документы прилагаются
541932	отчет пэк слать	как слать отчет ПЭК
541935	опвк фгис	фгис опвк
541935	отходы передача ртутьсодержащий	передача ртутьсодержащих отходов
541936	1 2 класс отходы	отходы 1 -2 класса
541936	2 класс отходы утилизировать	как утилизировать отходы 2 класса
541936	обращение опасный отходы с	обращение с опасными отходами
541936	1 инвентаризация класс отходы	инвентаризация отходов 1 класса
541940	документ какой сзз утверждать	каким документом утверждают СЗЗ
541940	граница исследование натурный после проведение расчетный сзз установление шаг	шаг после проведения натурных исследований для установления расчетной границы СЗЗ
541941	накопление норматив петербург санкт тко	норматив накопления тко санкт-петербург
541941	петербург плотность санкт тко	плотность тко санкт-петербург
541943	iii защитный зона категория нвос объект санитарный устанавливать	нужно ли объектам III категории НВОС устанавливать санитарно-защитные зоны
541943	ли предприятие сзз	нужна ли предприятию СЗЗ
541943	iv защитный зона категория нвос объект санитарный устанавливать	нужно ли объектам IV категории НВОС устанавливать санитарно-защитные зоны
542061	вода контроль лаборатория сточный	Лаборатория для контроля сточных вод
542061	вещество вода загрязнять контроль сточный	Контроль загрязняющих веществ в сточных водах
542061	вода качество контролировать сточный	Как контролировать качество сточной воды
542061	вода замеривать качество лаборатория показатель сточный	Показатели качества сточных вод замеряет лаборатория
542062	вода ливневый очистка сточный требование	Требования к очистке ливневых сточных вод
542062	ливневый очищать сток	Нужно ли очищать ливнёвые стоки
542062	вода ливневый очистка сточный	Очистка ливневых сточных вод
542064	бытовой жидкий отходы	Что такое жидкие бытовые отходы
542064	бытовой жидкий когда не относиться отходы сток	Когда жидкие бытовые отходы не относятся к стокам
542066	декларация роп	декларация роп
542066	выпускать декларация количество товар	декларация о количестве выпущенных товаров
540794	инвентаризация отходы оформлять	как оформить инвентаризацию отходов
540794	инвентаризация отходы отчет составлять	как составить отчет об инвентаризации отходов
541832	нвос плата	плата за нвос
541832	кто нвос платить	кто платит за нвос
541832	воздействие негативный плата	плата за негативное воздействие
542007	рельеф сброс	Сброс на рельеф
542007	вода почва сброс сточный	Сброс сточных вод на почву
542007	вода местность рельеф сточный	Сточные воды на рельеф местности
542007	вещество вода загрязнять рельеф сбросить сточный	загрязняющие вещества сточных вод, сброшенных на рельеф
541770	декларация надо нвос плата прикладывать	декларация о плате за нвос что надо прикладывать
541770	вставлять декларация депонировать документ который нвос росприроднадзор	как вставить в декларацию НВОС депонируемые документы которые просит Росприроднадзор
541770	декларация документ какой нвос прикладывать	какие документы прикладывать к декларации за нвос
541947	задание защитный зона и проект разработка санитарный согласование технический	Техническое задание на разработку и согласование проекта санитарно-защитной зоны
541947	сзз техзадание	Техзадание для СЗЗ
541951	договор медотходы с фэо	договор с фэо на медотходы
541951	медицинский отход фэо	медицинские отходы фэо
541951	1 2 класс медицинский отход	медицинские отходы 1 2 класса
541952	лист самопроверка чек	чек-лист самопроверки
541952	документ перечень	перечень документов
542070	воздействие категория негативный объект окружающий среда	категории объекта негативного воздействия на окружающую среду
542070	категория нвос объект требование	требования для объектов категорий нвос
542070	влиять значительно какой категория окружающий организация относиться среда	К какой категории относятся организации, значительно влияющие на окружающую среду
542071	бытовой жидкий отходы оформление	Оформление жидких бытовых отходов
542071	документ жбо	Документы ЖБО
542073	б инструкция класс медицинский обращение отход с	инструкция по обращению с медицинскими отходами класса Б
542073	инструкция медотход обращение с	инструкция по обращению с медотходами
541652	долго инвентаризация отходы отчет хранить	как долго хранить отчет об инвентаризации отходов
541652	инвентаризация отходы сколько хранить	сколько хранить инвентаризацию отходов
541652	долго инвентаризация отходы хранить	как долго хранить инвентаризацию отходов
541879	отчетность роп	отчетность по роп
541879	какой необходимо отчетность роп сдавать	Какую еще необходимо сдавать отчетность по РОП?
541639	наименование необходимо организация отход паспорт переоформлять полностью смениться	У организации сменилось наименование. Паспорт на отход необходимо переоформить полностью?
541639	а делать достаточно изменение или компонентный лицо наименование наименование новый отход отход паспорт переоформлять прикладывать протокол протокол случай со состав старый юридический юрлица	Подскажите, пожалуйста, в случае изменения наименования юридического лица, надо ли по новой делать протоколы компонентного состава отхода или достаточно переоформить только паспорт отхода, а протокол приложить со старым наименованием юрлица?
541639	название организация паспорт переоформлять смениться	Нужно ли переоформлять паспорт если сменилось название организации
541640	нму приказ	приказ нму
541640	выброс мероприятие метеореологический неблагоприятный нму период план приказ уменьшение условие	Приказ о плане мероприятий по уменьшению выбросов в период неблагоприятных метеореологических условий (НМУ)
541856	аутсорсинг	аутсорсинг
541856	услуга экологический	экологические услуги
541859	выброс изменяться инвентаризация ли не обязательно проводоить технология	обязательно ли проводоить инвентаризацию выбросов если технология не изменилась
