TemplateID	LmQuery	Query
533060	воздушно выявление инфекция капельный мероприятие пациент передаваться противоэпидемический путь сопа	соп «противоэпидемические мероприятия при выявлении инфекций, передающихся воздушно-капельным путем, у пациента».
533145	безопасность контроль лист сектор соблюдение чек эпидемиологический	Чек-лист контроля сектора соблюдения эпидемиологической безопасности
533145	безопасность контроль лист чек эпидемиологический	Чек-лист контроля эпидемиологической безопасности
533145	контроль лист подразделение чек эпидбезопасность	Чек-лист контроля эпидбезопасности в подразделении
533235	инвентарь лист уборочный хранение чек	чек-лист по хранению уборочного инвентаря
533236	ведение контроль лист меддокументация чек эпидбезопасность	Чек-лист контроль ведения меддокументации по эпидбезопасности
533236	ведение контроль меддокументация эпидбезопасность	контроль ведения меддокументации по эпидбезопасности
533236	ведение документация лист чек эпидбезопасеость	чек-лист ведение документации по эпидбезопасеости
533239	изделие лист медицинский хранение чек	Хранение медицинских изделий чек-лист
533239	лист медизделие хранение чек	чек-лист по хранению медизделий
533240	лекарственный лист препарат хранение чек	хранение лекарственных препаратов чек-лист
533240	лекарство лист мед организация хранение чек	чек-лист хранения лекарств в мед организации
534235	паспорт холера	паспорт холер
534235	07 1 1 2232 3 3 му приложение	му 3.1.1.2232-07 приложение 3
534235	госпиталь холерный	холерный госпиталь
534235	главный контроль медсестра подготовка точка холера	точки контроля главной медсестры при подготовке к холере
533876	дело кто можно организация работать сестринский со специальность	Кем можно работать со специальностью «Организация сестринского дела»
533876	дело должность какой организация сестринский специальность	для какой должности нужна специальность организация сестринского дела
533876	дело организация сестринский специалист	специалист по организации сестринского дела
533877	взрослый во дело медсестра педиатрия поликлиника работать с сертификат сестринский	может ли медсестра с сертификатом сестринское дело в педиатрии. работать во взрослой поликлинике
533877	дело дело медсестра педиатрия принимать с с сертификат сестринский	можно ли принять медсестру с сертификатом с/дело в педиатрии на сестринское дело
533877	дело медсестра офтальмология педиатрия принимать с сертификат сестринский	можно ли принять медсестру в офтальмологию с сертификатом сестринское дело в педиатрии
533878	больница дело дело детский должность и медсестра организация принимать сестринский сестринский со сотрудник специализация старший	Можно ли принять на должность старшей медсестры в детской больнице сотрудника со специализацией «Сестринское дело» и «Организация сестринского дела»
533878	дело лицензия медсестра нет педиатрия педиатрия сестринский специальность устраивать	если в лицензии нет педиатрии, можем ли устроить медсестру по специальности сестринское дело в педиатрии
533879	быть должный забор какой который кровь медсестра проводить ребенок сертификат	Какой сертификат должен быть у медсестры, которая проводит забор крови у детей
533879	должный иметь какой медсестра работать ребенок с сертификат	какой сертификат должны иметь медсестры работающие с детьми
533879	должный какой медсестра педиатрический сертификат участковый	участковая медсестра педиатрическая какой сертификат должен
533883	защитный надевание одежда порядок холера	порядок надевания защитной одежды при холере
533883	защитный защитный костюм надевание одежда порядок тип холера	порядок надевания защитной одежды, типы защитных костюмов при холере
535490	легенда обезьяна оспа	легенда по оспе обезьян
535490	оои перечень	перечень оои
535490	и личный мера оои профилактика средство	меры и средства личной профилактики при оои
535490	все чума	все о чуме
426370	микротравма профилактика	Профилактика микротравм
426370	заболевание профессиональный профилактика	профилактика профессиональных заболеваний
426370	алгоритм вмешательство инвазивный инфекция профилактика	алгоритм профилактики инфекций при инвазивных вмешательствах
426386	лекарство расчет сопа	соп расчет лекарств
426386	запас лекарство расчет сопа	соп расчет запаса лекарств
426387	внутренний порядок проведение проверка регламентировать сопа	соп регламентирующий порядок проведения внутренних проверок
426387	внутренний проверка сопа	внутренние проверки соп
426387	внутренний и лс медизделие обращение отделение проверка сопа	СОП «Внутренние проверки обращения ЛС и медизделий в отделениях»
426562	выплата мрот сверх стимулировать	стимулирующие выплаты сверх мрот
426562	выплата доплата мрот сверх стимулировать	стимулирующие выплаты сверх доплаты до мрот
534527	врач фрм	Врач ФРМ
534527	дело реабилитационный специалист	специалист по реабилитационному делу
534241	запас лекарственный расчет средство холера	расчет запасов лекарственных средств при холере
534241	лекарственный обеспечение холера	лекарственный обеспечение при холере
534423	годность истекший лекарство объяснительный с списание срок	Объяснительная для списания лекарств с истекшим сроком годности
534423	лекарство объяснительный просрочивать списание	Объяснительная для списания просроченных лекарств
534433	внеплановый инвентаризация приказ проведение	Приказ о проведении внеплановой инвентаризации
534433	инвентаризация приказ проведение	Приказ о проведении инвентаризации
534433	инвентаризация лекарство приказ	приказ по инвентаризации лекарств
536108	клещ сопа соскоб чесоточный	соп соскоб чесоточный клещ
536108	взятие клещ сопа соскоб чесоточный	СОП «Взятие соскоба на чесоточного клеща»
536108	клещ чесоточный	чесоточный клещ
536112	глюкоза глюкометр кровь проведение сопа тесто	соп проведение теста на глюкозу крови глюкометром
536112	глюкометр помощь проведение сопа тестирование экспресс	соп проведение экспресс тестирования при помощи глюкометра
536112	глюкометр пользоваться сопа	соп как пользоваться глюкометром
536112	глюкометр сахар сопа	соп на сахар на глюкометре
536140	нефростома сопа уход	соп уход за нефростомой
536140	алгоритм нефростома уход	алгоритм ухода за нефростомой
536140	нефростома уход	уход за нефростомой
534646	б класс контроль отход производственный с	производственный контроль с отходами класса б
534646	контроль отход производственный с	производственный контроль с отходами
534646	контроль медотходы производственный	производственный контроль медотходы
535465	вещь инструкция пациент передача родственник	инструкция передача вещей пациентов родственникам
535465	запрещать лпу пациент передача продукт санпин	санпин по запрещенным продуктам для передачи пациентам в лпу
535465	пациент продукт разрешать	Разрешенные продукты пациентам
535467	класс отходы памперс	памперсы - отходы класса
535467	памперс санпин утилизация	утилизация памперсов по санпину
536713	количество лейкоцит определение сопа	СОП «Определение количества лейкоцитов»
536713	количество лейкоцит определение	Определение количества лейкоцитов
536628	анестезия внутривенный сопа тотальный	СОП «Тотальная внутривенная анестезия»
536628	анестезия внутривенный тотальный	Тотальная внутривенная анестезия
536628	анестезия внутривенный проведение тотальный	проведение тотальной внутривенной анестезии
536629	анестезия сопа спинномозговой	СОП «Спинномозговая анестезия»
536629	анестезия проведение спинномозговой	Проведение спинномозговой анестезии
536631	боль головной лечение постпункционный синдром сопа	СОП «Лечение синдрома постпункционной головной боли»
536631	боль головной лечение постпункционный синдром	Лечение синдрома постпункционной головной боли
536631	боль головной постпункционный	постпункционная головная боль
536632	план тренировочный учение холера	план тренировочного учения по холере
536632	пример учение холера	пример учений по холере
536632	сценарий учение холера	Сценарий учений по холере
535486	2023 год кабинет неотложный педиатр помощь укладка	укладка неотложной помощи в кабинете педиатра 2023 год
535486	2023год кабинет неотложный педиатр помощь укладка	укладка неотложной помощи в кабинете педиатра 2023год
535658	бухгалтерия положение утверждение	об утверждении положения о бухгалтерии
535658	бухгалтерия положение	положения о бухгалтерии
535658	бухгалтерия положение приказ утверждение	приказ об утверждении положения о бухгалтерии
537383	и медицинский осмотр послерейсовый послесменный предрейсовый предсменный проведение сопа	соп по проведению предсменных предрейсовых и послесменных послерейсовыхъ медицинских осмотров
537383	предрейсовый проведение сопа	соп проведение предрейсового
537296	должностной инструкция старший фельдшер	должностная инструкция старший фельдшер
427359	какой медосмотр приказ	медосмотры какие приказы
427359	документ медосмотр нормативный	нормативные документы по медосмотрам
427359	и медицинский осмотр периодический предварительный	предварительные и периодические медицинские осмотры
535470	исмп медицинский обучение персонал план профилактика средний	план обучения среднего медицинского персонала по профилактике ИСМП
535470	исмп обучение	ИСМП обучение
535840	медицинский сестра совет	совет медицинских сестер
535840	положение сестра совет	положение о совете сестер
535840	квалификация комиссия медицинский повышение сестра совет функция	совет медицинских сестер функции комиссии по повышению квалификации
535840	дело сестринский совет структура	совет по сестринскому делу структура
538103	алгоритм вич новый профилактика санпин скачать	скачайте алгоритмы профилактики вич по новому санпину
538103	21 3686 аварийный алгоритм вич внедрять главный инструкция медсестра они они перестраивать появляться профилактика разный с санпин система случай требование успевать учет	в системе главная медсестра появились инструкции по профилактике вич с учетом требований санпин 3686-21. в них - алгоритмы для разных случаев аварийных ситуаций. внедрите их, чтобы успеть перестроить
538103	алгоритм вич действие заражение угроза	алгоритм действий при угрозе заражения вич
538103	ак вич инфицирование новый проводить профилактика санпин	ак проводить профилактику инфицирования вич по новому санпину
538103	прокол случай	в случае проколов
538103	вич инфекция	вич инфекция
536707	бронхоскопия проведение сопа	соп проведение бронхоскопии
536707	бронхоскопия действие мс проведение	действия мс при проведении бронхоскопии
536459	анестезия проведение эпидуральный	проведение эпидуральной анестезии
536459	анестезия проведение сопа эпидуральный	проведение эпидуральной анестезии соп
536459	анестезия сопа эпидуральный	СОП «Эпидуральная анестезия»
537723	акушерка главный	Главная акушерка
537723	акушерка главный должностной инструкция	Должностная инструкция главной акушерки
537279	должностной медсестра обязанность рентген старший	должностные обязанности старшей медсестры рентгена
537279	клиника медсестра отделение работа регламент старший стомат частный	регламент работы старшей медсестры стомат отделения частная клиника
537279	медсестра отделение работа регламент старший стомат	регламент работы старшей медсестры стомат отделения
427516	890н приказ	приказ 890н
427516	17 2020 890н приказ сентябрь	890н приказ от 17 сентября 2020
427516	08 2020 24 890н n минздрав приказ россия	приказ минздрава россии от 24.08.2020 n 890н
427516	категория мораторий приказ снятие	приказ о снятие моратория по категории
427532	382 лекарственный приказ средство уничтожение	приказ № 382 об уничтожении лекарственных средств
427532	382 лекарственный приказ списание средство	приказ № 382 о списании лекарственных средств
427533	07 2020 2510 31 минпромторг приказ рф	приказ минпромторга рф от 31.07.2020 № 2510
427533	2510 приказ	приказ № 2510 от
427534	81н приказ	приказ 81н
427534	02 2014 21 81н г государственный единство здравоохранение измерение измерение министерство обеспечение относиться перечень приказ регулирование российский сфера утверждение федерация	приказ министерства здравоохранения российской федерации о № 81н от 21.02.2014 г. «об утверждении перечня измерений, относящихся к сфере государственного регулирования обеспечения единства измерений,
427534	81по метрология приказ	приказ 81по метрологии
427535	40н приказ	приказ 40н
427535	2021 40н минздрав приказ россия	приказ минздрава россии 2021, 40н
427535	02 02 21 40н приказ	приказ 40н 02.02.21
427536	01 12 2016 917 приказ	приказ от 01.12.2016 917
427536	917 наркотический норматив приказ расчет утверждение	приказ № 917 об утверждении нормативов для расчета наркотических
427536	917 приказ	приказ 917
427633	комиссия корешок лн приказ уничтожение	приказ о комиссии по уничтожению корешков лн
427633	18 2004 29 29 n г и минздрав приказ рф рф социальный страхование фонд январь	приказ фонда социального страхования рф и минздрава рф от 29 января 2004 г. n 18/29
427633	18 29 приказ	приказ № 18/29
427634	1089 листок мз нетрудоспособность приказ	1089 приказ мз листки нетрудоспособности
427634	1 2020 925н приказ сентябрь	приказ 925н от 1 сентября 2020
427634	больничный лист минздрав оформление приказ электронный	приказ минздрава по оформлению электронного больничного листа
427634	выдача лист нетрудоспособность приказ	приказ по выдачи листов нетрудоспособности
427634	925н приказ	приказ 925н
427635	124н диспансеризация приказ	приказ № 124н диспансеризация
427635	124н 13 2019 взрослый г группа диспансеризация здравоохранение и март медицинский министерство население определять осмотр порядок приказ проведение профилактический рф утверждение	приказ министерства здравоохранения рф от 13 марта 2019 г. № 124н об утверждении порядка проведения профилактического медицинского осмотра и диспансеризации определенных групп взрослого населения
427637	взрослый и изделие комплектация лекарственный медико медицинский неотложный оказание первичный помощь препарат санитарный требование укладка утверждение форма	об утверждении требований к комплектации лекарственными препаратами и медицинскими изделиями укладки для оказания первичной медико-санитарной помощи взрослым в неотложной форме.
427637	аптечка неотложный приказ состояние формирование	приказ по формированию аптечки по неотложным состояниям
427637	комплектация приказ противошоковый укладка	комплектация противошоковой укладки приказ
427637	изделие медицинский новый приказ	новые приказы по медицинским изделиям
537570	кто мочь работать сестра хозяйка	Кто может работать сестрой-хозяйкой
537570	образование сестра требование хозяйка	Требования к образованию для сестры-хозяйки
537560	мед сестра стафилококк	если у мед сестры стафилококк
