TemplateID	LmQuery	Query
32733	д класс отход работа с схема	схема работы с отходами класса д
32733	д класс отходы сопа	соп отходы класса д
410376	лист медорганизация организация охрана труд чек	Чек-лист по организации охраны труда в медорганизации
410376	лист охрана руководитель труд чек	чек-листы для руководителя по охране труда
1374	защита индивидуальный коронавирус надевание сопа средство	соп надевания средств индивидуальной защиты при коронавирусе
1374	алгоритм костюм наглядно одевание противочумный	алгоритм одевания противочумного костюма наглядно
1374	и комбинезон надевать противочумный снимать сопа	соп надеть и снять противочумный комбинезон
1374	алгоритм одевание сизый	алгоритм одевания сиз
1374	внешний защитный инфицировать костюм который многоразовый порядок потенциально снятие сопа сторона	соп порядок снятия многоразового защитного костюма, внешняя сторона которых потенциально инфицирована.
1374	алгоритм защитный и костюм надевать оои противочумный снимать	алгоритм как надевать и снимать защитный противочумный костюм при оои
1375	использование респиратор сопа	соп использование респираторов
1375	алгоритм использование маска	алгоритм использования маски
1375	алгоритм маска многоразовый обработка сопа	соп алгоритм обработки многоразовых масок
1375	алгоритм респиратор снятие	алгоритм снятия респиратора
1375	алгоритм маска обработка одноразовый	алгоритм обработки одноразовой маски
1371	блок выполнение генеральный сопа схема уборка	соп генеральная уборка блок схема выполнения
1371	генеральный сопа уборка	сопы генеральная уборка
1371	ген инструкция проведение уборка	инструкция по проведению ген уборки
1371	алгоритм генеральный лист санпин сопа уборка чек	генеральная уборка чек-листы, соп, алгоритмы СанПиН
1371	генеральный операционный проведение процедура стандартный уборка	стандартная операционная процедура при проведении генеральной уборки
1373	аптека сопа стационар	соп аптека в стационаре
1373	сопа фармацевт	сопы для фармацевта
1373	аптека медицинский организация сопа	соп для аптеки медицинской организации
1370	2019 covid дезинфекция заключительный сопа	соп по заключительной дезинфекции при covid-2019
1370	заключительный проведение сопа уборка	соп по проведению заключительной уборке
1370	заключительный инфекционный проведение сопа стационар уборка	соп проведение заключительной уборки в инфекционном стационаре
2110	во время журнал заполнять пандемия текущий уборка	как заполнять журнал текущих уборок во время пандемии
2110	вести весь журнал помещение проведение текущий уборка	нужно ли вести журнал проведения текущих уборок всех помещений
2110	дополнительный журнал и текущий уборка	журнал текущей и дополнительной уборки
2110	дополнительный журнал и медицинский текущий уборка учреждение	журнал текущей и дополнительной уборки в медицинском учреждении
2110	журнал контроль уборка	контроль за уборкой журнал
2110	влажный журнал проведение уборка шаблон	шаблон журнала по проведению влажных уборок
2110	журнал проведение текущий уборка форма	форма журнала проведения текущих уборок
2112	выдача журнал маска	журнал выдачи масок
2112	выдача журнал образец сизый	образец журнала выдачи сиз
2496	организовывать работа сестра совет	как организовать работу совета сестер
2496	медсестра совет совет структура	совет медсестер структура совета
2492	дополнительный медсестра нагрузка	дополнительная нагрузка медсестры
2492	медсестра рабочий час	рабочие часы для медсестры
2493	медсестра нагрузка отделение приемный	нагрузка на медсестру приемного отделения
2493	медсестра норма час	норма часов для медсестер
1292	лексредство сопа	сопы лексредства
1292	и лекарство оборот сопа хранение	соп по хранению и обороту лекарств
1292	лп обращение сопа	соп по обращению лп
1292	использование лек операционный процедура средство стандартный учет хранение	стандартные операционная процедура по учету .хранению .использованию лек средств
1292	главный лекарственный медсестра сопа средство	сопы по лекарственным средствам для главной медсестры
1292	весь главный длсанпин лекарство медсестра отходы сопа	все сопы по лекарствам длсанпин по отходам главной медсестры
1293	весь дезинфекция сопа	дезинфекция все сопы
1293	дезинфекция сопа стерилизация	соп дезинфекция стерилизация
1293	дезинфекция проведение сопа	соп проведение дезинфекции
1293	дезинфекционный мероприятие проведение сопа стерилизационный	сопы проведение дезинфекционно-стерилизационных мероприятий
1294	и нс пв сопа	сопы по нс и пв
1294	наркотический работа с сопа средство	сопы по работе с наркотическими средствами
1294	главный и комплект медсестра нс оборот организовывать пв помощь соп	«как организовать оборот нс и пв: комплект сопов в помощь главной медсестре»
1294	дейсвия ми наркотич порядок работа с сопа	соп порядок дейсвия при работе с наркотич в-ми
1294	алгоритм и нс пв	алгоритм нс и пв
1294	вещество и наркотический оборот психотропный сопа	соп оборот наркотических и психотропных веществ
1376	сизый сопа	соп сиз
1376	защита применение сопа средство	соп по применению средств защиты
1376	заражение инфекция коронавирусный применение профилактика сизый сопа	соп применение сиз для профилактики заражения коронавирусной инфекцией
1376	использование правило сизый сопа	соп правила использования сиз
1290	алгоритм обработка персонал рука	алгоритм обработки рук персонала
1290	обработка рука сопа	сопы по обработке рук
1290	обеззараживание рука	обеззараживание рук
1290	мытье сопа	соп по мытью
1368	защита обеспечение сопа травмирование	соп по обеспечению защиты от травмирования
1368	падение сопа	сопы при падении
1367	автомобиль дезинфекция оои салон	дезинфекция салона автомобиля при оои
1367	внутри дезинфекция проведение сопа транспорт	соп проведения дезинфекции транспорта внутри
1369	заключительный пандемия сопа уборка	соп по заключительной уборка при пандемии
1369	алгоритм бокс инфекционный уборка	алгоритм уборки инфекционных боксов
1366	дезинфекционный лпу приказ режим усиление	приказ о усилении дезинфекционного режима в лпу
1366	01 03 2020 алгоритм действие инфекция коронавирусный медицинский новый подозрение работник роспотребнадзор	информация роспотребнадзора от 01.03.2020. алгоритм действия медицинского работника при подозрении на новую коронавирусную инфекцию
2111	генеральный журнал сестра уборка хозяйка	журнал генеральных уборок для сестры-хозяйки
2111	генеральный журнал уборка форма	формы журналов генеральных уборок
2111	гендер журнал уборка	журнал гендер уборки
2113	журнал контроль разведение ц	журнал контроля разведения ц
2113	дез журнал контроль концентрация средство	журнал контроля концентрации дез средств
2113	дезинфицировать журнал и контроль концентрация рабочий раствор средство стерилизовать	журнал контроля концентраций рабочих растворов дезинфицирующих и стерилизующих средств
2113	дезраствор журнал разведение	журнал разведения дезрастворов
2516	дезинфекция пандемия сопа усилять	соп усиленная дезинфекция при пандемии
2516	дезинфекционный инфекция коронавирусный режим усиление	усиление дезинфекционного режима при коронавирусной инфекции
2516	19 covid дезинфекционный каждый мероприятие подразделение проведение распространение усиленный условие	проведения усиленных дезинфекционных мероприятий в условиях распространения covid-19 в каждом подразделении
2516	дезинфекционный проведение сопа усиленный	соп по проведению усиленных дезинфекционных
2516	алгоритм дезинфекция и организация проведение	алгоритм организации и проведении дезинфекции
2500	лист медсестра навык оценка подбирать работа чек	подобрать чек-листы для оценки навыков работы медсестер
2500	медсестра оценка работа стоматология эффективность	оценка эффективности работы медсестер в стоматологии
2500	квалификационный кто медсестра оценивать пригодность	кто оценивает квалификационную пригодность медсестер
1817	инъекция калильный постановка сопа	соп на постановку в/в калильной инъекции
1817	алгоритм делать и инъекция сопа	как делать инъекции сопы и алгоритмы
1820	идентификация пациент сопа	сопы идентификация пациента
1820	пациент распознавание	распознавание пациента
1820	весь идентификация личность сопа	все сопы идентификация личности
2478	диетический должностной инструкция медсестра	должностные инструкции медсестры диетической
2478	алгоритм диетический медсестра работа	алгоритм работы диетической медсестры
2480	кабинет медсестра прививочный	медсестра прививочного кабинета
2480	кабинет медсестра образование прививочный	образование медсестры прививочного кабинета
2481	должностной инструкция медсестра палатный	должностная инструкция медсестры палатной
2481	должностной инструкция медицинский медсестра палатный сестра	должностная инструкция медсестры палатной медицинской сестры
2481	должностной медсестра полатный	полатная медсестра должностная
2482	должностной инструкция медсестра покой приемный	должностная инструкция медсестры приемного покоя
2482	медсестра обязанность покой приемный	обязанности медсестры приемного покоя
2483	медсестра перевязочный работа	работа перевязочной медсестры
2483	должностной инструкция кабинет медсестра перевязочный	должностная инструкция медсестры перевязочного кабинета
2486	водолечебница должностной инструкция медсестра	должностная инструкция медсестры водолечебницы
2486	медсестра узи	медсестра узи
2486	должностной инструкция медсестра	должностная инструкция медсестры
2486	должностной интенсивный медсестра обязанность терапия	должностные обязанности медсестры интенсивной терапии
2488	анализ медсестра отд работа стационар хирургический	анализ работы медсестры хирургического отд. стационара
2488	медсестра операционный	медсестра операционная
2488	медсестра отделение работа хирургический	работа медсестры хирургического отделения
2533	алгоритм гигиена и обработка рука хирургический	хирургическая гигиена и обработка рук алгоритм
2533	алгоритм рука уборка	алгоритм уборки рук
2533	алгоритм дезинфицирующий завершение медицинский обработка оказание пациент перчатка помощь рука средство	алгоритм обработка рук в перчатках дезинфицирующим средством; по завершении оказания медицинской помощи пациенту
2533	алгоритм аптека обработка рука	алгоритм обработки рук в аптеке
1818	забор кровь сопа	соп забор крови
1818	кровь сопа	соп по крови
1818	забор капиллярный кровь сопа	забор капиллярной крови соп
1818	забор кровь палец сопа	забор крови из пальца соп
1819	алгоритм неотложный помощь	алгоритм неотложной помощи при
1819	доврачебный неотложный помощь сопа	соп неотложная доврачебная помощь
1819	неотложный поликлиника сопа состояние	соп неотложные состояния в поликлиники
1819	оказание помощь сопа экстренный	сопы по оказанию экстренной помощи
1621	организация пролежень профилактика работа	организация работы по профилактике пролежней
1621	лист назначение пролежень	лист назначений пролежней
1621	гост новый определять пролежень пролежень профилактика работать развитие стадия	как работать по новому госту «профилактика пролежней. определите стадию развития пролежней
1621	пролежень работа с	работа с пролежнями
1621	и лечение пролежень профилактика	профилактика и лечение пролежней
1621	новый правило пролежень	пролежни новые правила
1621	положение пролежень сестринский уход	положение сестринского ухода за пролежнями
1622	2019 covid алгоритм выбор дезсредство	алгоритм выбора дезсредств при covid-2019
1622	алгоритм дезинфекция дезинфицирующий и наличие средство тактика	наличие алгоритма дезинфицирующих средств и тактики дезинфекции
1622	алгоритм выбор дез ср	алгоритм выбора дез.ср-в
1812	алгоритм использовать костюм обработка	алгоритм по обработке использованных костюмов
1812	алгоритм дезинфекция костюм	алгоритм дезинфекции костюма
1812	алгоритм дезинфекция костюм многоразовый противочумный	алгоритм по дезинфекции многоразового противочумного костюма
2476	анестезист должностной медсестра	должностная на медсестру анестезиста
2476	анестезистка должностной медсестра обязанность	должностные обязанности медсестры анестезистки
2476	анестезиология и медсестра отделение реанимация	медсестра отделения анестезиологии и реанимации
2534	алгоритм надевание перчатка	алгоритм надевания перчаток
2534	и одевание перчатка снятие техника	техника снятия и одевания перчаток
2535	алгоритм действие инструкция коронавирус пандемия схема	пандемия коронавируса алгоритмы действий схемы инструкции
2535	алгоритм выявление заболевание инфекция коронавирусный пациент подозрительный	алгоритм при выявлении подозрительного на заболевание коронавирусной инфекцией пациента.
2535	2019 covid алгоритм контактный медицинский работа работник с	алгоритм работы медицинских работников при контактных с covid-2019
2535	2019 covid алгоритм	covid-2019 алгоритмы
2535	алгоритм действие короновирус медработник стационар	алгоритм действий медработников в стационаре при короновирусе
2535	алгоритм весь действовать инфекция источник коронавирусный медсестра	как действовать при коронавирусной инфекции: все алгоритмы для медсестер источник:
2535	2019 ncov алгоритм действие инфекция коронавирусный подозрение	алгоритм действий при подозрении на коронавирусную инфекцию 2019- ncov
2537	алгоритм измерение тело температура	алгоритм измерения температуры тела
2537	алгоритм без измерение контактный тело температура термометр	алгоритм измерения температуры тела без контактным термометром
2538	кто машина обработка проводить скорый	кто проводит обработку машин скорой
2538	алгоритм биологический исследование коронавирус материал обработка санитарный транспорт транспортировка	алгоритм обработки санитарного транспорта при транспортировке биологического материала по исследованию на коронавирус
2538	дезинфекция лист помощь салон скорый чек	чек-лист по дезинфекции салона скорой помощи
2538	автотранспорт алгоритм дезинфекция медицинский помощь	алгоритм дезинфекции автотранспорта медицинской помощи
1617	19 covid алгоритм допуск медицинский пост сотрудник условие	алгоритм допуска сотрудников на медицинских постах в условиях covid-19
1617	алгоритм вход допуск допуск медицинский мо пост работа сотрудник сотрудник учет форма	алгоритм допуска сотрудников на медицинских постах при входе в мо .форма учета допуска сотрудников к работе
1617	алгоритм вход допуск сотрудник	алгоритм допуска сотрудников при входе
1619	памятка	памятка
1619	алгоритм анафилактический действие шок	алгоритм действий при анафилактическом шоке
1619	алгоритм оказание помощь шок	алгоритм оказания помощи при шоке
