TemplateID	LmQuery	Query
541859	атмосфера загрязнение инвентаризация исправление источник	исправление инвентаризация источник загрязнение атмосфера
541864	медицинский отход	медицинские отходы
541864	медицинский отходы отчет	отчет по медицинским отходам
541864	какой мед отчет сдавать учреждение	Какие отчеты сдает мед учреждение
541633	отходы паспорт	паспорт отходов
541633	где класс отход токсичность указывать	класс токсичности отхода где указать
541633	4 5 вывоз категория мусор образец паспорт	Образец паспорта на вывоз мусора 4-5 категории
541634	вести вода сточный учет	Как вести учёт сточных вод
541634	вода журнал сточный учет	Журнал учёта сточной воды
541636	контрагент	контрагент
541636	документация разработка	разработка документации
541636	заказывать услуга экология	как заказать услуги по экологии
541636	обращение обязанность организация отходы подрядный	подрядная организация обязанности в обращении отходов
541838	выброс инвентаризация учитывать	что учесть в инвентаризации выбросов
541838	выброс инвентаризация источник стационарный	инвентаризация выбросов стационарных источников
541840	выброс инвентаризация источник	инвентаризация источников выбросов
541840	выброс инвентаризация когда проводить	когда проводить инвентаризацию выбросов
542143	гоу ответственный эксплуатация	ответственные за эксплуатацию гоу
542143	газоочистной назначение ответственный приказ установка эксплуатация	приказ о назначении ответственных за эксплуатацию газоочистных установок
546244	категория риск	что такое категории риска
546244	категория плановый проверка риск	категории риска плановых проверок
543628	абонент санкция цсв штрафной	Штрафные санкции для абонентов ЦСВ
543628	вода сброс сточный штраф	Штрафы за сброс сточных вод
543628	цсв штраф	Штрафы ЦСВ
543628	жбо штраф	Штрафы по ЖБО
543636	и контрольный кто надо створ устанавливать фоновый	Кому надо устанавливать фоновый и контрольный створы
543636	когда контрольный створ устанавливать	Когда нужно устанавливать контрольный створ
543638	зачем створ фоновый	Зачем нужен фоновый створ
543638	контрольный створ	Для чего нужны контрольные створы
543638	и контрольный роль створ фоновый	Роль контрольных и фоновых створов
543640	определять створ фоновый	Как определить фоновый створ
543640	водный где объект располагать створ фоновый	Где расположить фоновый створ на водном объекте
543641	водный контрольный объект расположение створ	Расположение контрольного створа на водном объекте
543641	контрольный определять створ	Как определить контрольный створ
544026	декларация нвос	декларация нвос
544026	декларация негативный плата	декларация о плате за негативное
544026	декларация плата	декларация платы
544664	вторичный материальный ресурс	вторичные материальные ресурсы
544664	вторичный ресурс	вторичные ресурсы
544664	вмр	ВМР
544665	вторсырье окпд	вторсырье ОКПД
544665	вторичный сырье	вторичное сырье
546225	сзз	сзз
546225	проект сзз	проект сзз
546225	сзз устанавливать	как установить сзз
544735	инструкция лом металл обращение черный	инструкция обращение лом черных металлов
544735	и лом металл несортированный отходы содержать цветной	лом и отходы содержащие несортированные цветные металлы
544735	и лом металл цветной черный	лом черных и цветных металлов
546150	акт ликвидация	акт о ликвидации
546150	ликвидация нвос объект	ликвидация объекта нвос
546121	отчет пэк сдача	сдача отчета пэк
546121	01 10 2022 67 7 ст фз	ст. 67 № 7-фз от 10.01.2022
545861	актион газ отчетность парниковый саммит экология	Саммит Актион экология отчётность по парниковым газам
545861	актион встреча итог москва правительство экология	итоги встречи Актион экология в Правительстве Москвы
545861	2023 актион итог июнь саммит экология	итоги саммита Актион экология июнь 2023
545861	актион саммит санкция штрафной экология	Саммит Актион экология штрафные санкции
545861	актион саммит хаменешко экология	Саммит Актион экология Хаменешко
545861	актион второй класс опасность отходы первый саммит экология	Саммит Актион экология отходы первого второго класса опасности
545861	актион выброс квотирование саммит экология	Саммит Актион экология квотирование выбросов
545855	выброс допустимый предельно проект разработка техзадание	разработка проекта предельно допустимых выбросов техзадание
545855	задание пдв технический	техническое задание на ПДВ
545855	пдв проект составлять техзадание	Проект ПДВ как составить техзадание
545855	пдв проект техзадание шаблон	Шаблон техзадания для проекта ПДВ
545859	и конституционный муниципал решение свалка суд	Решение Конституционного суда свалки и муниципалы
545859	жалоба конституционный муниципалитет решение суд	Решение Конституционного суда по жалобе муниципалитетов
544045	актуализация объект	актуализация объекта
544045	актуализация нвос объект сведение	актуализации сведений об объекте нвос
544045	актуализация	актуализация
544047	корректировка	корректировка
544047	заявление корректировка нвос объект реестр сведение содержать	заявление о корректировке сведений объекта нвос,содержащих в реестре
546998	обучаться экология	как обучиться по экологии
546998	безопасность урок экологический	уроки по экологической безопасности
546998	направлять обращение обучение отход с	как направить на обучение по обращению с отходами
547000	когда лицензия отходы	когда нужна лицензия на отходы
547000	кто лицензия отходы	кому нужна лицензия на отходы
547005	когда отход продукт становиться	когда продукт становится отходом
547005	когда относить отход побочный продукт производство	когда побочный продукт производства отнесут к отходу
547005	когда отход побочный признавать продукт производство	когда побочный продукт производства признают к отходом
545838	2 категория кэр объект получение	получение кэр для объектов 2 категории
545838	2 категория кэр	кэр для 2 категории
545838	ii категория кэр	кэр для II категории
546255	газ критерий парниковый	критерии парниковые газы
546255	газ критерий организация отнесение парниковый регулируемый	критерии отнесения к регулируемым организациям по парниковым газам
546255	зола со2 содержание	% содержания со2 в золе
546257	газ парниковый перечень	перечень парниковых газов
546257	газ парниковый список	список парниковых газов
546257	10 2020 22 2979 распоряжение	распоряжение 2979 от 22.10.2020
549782	словарь экология	словарь по экологии
549782	термин экология	термины по экологии
549791	делать природнадзор проверка	что делать проверка природнадзора
549791	внеплановый подготавливаться проверка	подготовиться к внеплановой проверке
549791	подготовка проверка экология	подготовка к проверке по экологии
549791	подготовка проверка	подготовка к проверке
549792	лист проверка чек экология	чек-лист проверки по экологии
549792	лист проверочный экология	проверочные листы по экологии
549792	лист самопроверка экология	лист самопроверки по экологии
547595	заполнять кто отходы отчет пэк сведение	кто заполняет сведения об отходах в отчете ПЭК
547595	мсп отходы отчет	отчет об отходах МСП
547595	и и использование малый обезвреживание образование отходы отчетность предпринимательство размещение средний субъект	отчетность об образовании, использовании, обезвреживании и размещении отходов для субъектов малого и среднего предпринимательства
546231	декларация нвос штраф	штрафы декларация нвос
546231	2 декларация коап нвос не отход рф с соответствие тп	коап рф об не соответствии 2-тп отхода с декларацией нвос
546967	выброс инвентаризация оформлять	как оформить инвентаризацию выбросов
546967	изав инвентаризация отчет	отчет о инвентаризации изав
546713	действие квалификация повышение срок удостоверение	срок действия удостоверения о повышении квалификации
546713	квалификация повышать часто	как часто повышать квалификацию
546262	вещество нвос перечень плата	перечень веществ плата за нвос
546262	1316 р	1316-р
547735	какой отходы приказ учет	учет отходов какой приказ
547735	01 09 2011 721 минприроды приказ россия	приказ минприроды россии от 01.09.2011 № 721
549586	iii категория ндв объект проект	проект НДВ для объектов III категории
549586	4 категория объект пдв проект	проект ПДВ для объектов 4 категории
549586	iv зачем категория объект пдв проект	Зачем нужен проект ПДВ для объектов IV категории
549586	iii зачем категория ндв объект проект	Зачем нужен проект НДВ для объектов III категории
549586	ндв	Для чего нужен НДВ
549586	ii категория объект пдв проект	Для чего нужен проект ПДВ для объектов II категории
549588	без изав организация пдв разработка	Разработка ПДВ для организаций без ИЗАВ
549588	без источник компания ли ндв стационарный	Нужен ли НДВ для компаний без стационарных источников
549588	изав ндв нет рассчитать стационарный	Как рассчитать НДВ если нет стационарных ИЗАВ
549590	1316 быть вещество выброс делать который нет р	что делать, если в выбросах есть вещества, которых нет в 1316-р
549590	вещество использовать какой пдв расчет	какие вещества используют для расчётов ПДВ
549590	1316 вещество и пдв перечень р распоряжение	ПДВ и перечень веществ из распоряжения 1316-р
549591	пдв проект срок	Проект ПДВ срок
549591	пдв проект разрабатывать сколько	Сколько разрабатывают проект ПДВ
549591	время ндв проект сколько	Сколько времени нужно на проект НДВ
549592	ндв проект	Что нужно для проекта НДВ
549592	581 и ндв приказ проект содержание состав	Состав и содержание проекта НДВ по приказу № 581
549592	пдв проект рассчитать	Как рассчитать проект ПДВ
547654	вода качество питьевой приведение программа	программа по приведению качестве питьевой воды
547654	вода качество питьевой приведение программа с соответствие требование установленный	программа по приведению качества питьевой воды в соответствии с установленными требованиями
547555	классификация санитарный	санитарная классификация
547555	санклассификация	санклассификация
547555	классификация санитарный сзз	санитарная классификация для сзз
547739	защитный зона санитарный устанавливать	как установить санитарно-защитную зону
547739	сзз устанавливать	как установить СЗЗ
547739	сделать сзз утверждение	что сделать для утверждения СЗЗ
549597	выброс металл механический обработка	выбросы механическая обработка металлов
549597	данные ндв проект разработка	Данные для разработки проекта НДВ
549597	выброс краска	выбросы краска
549598	сопровождение	сопровождение
549598	заказывать зачем сопровождение экологический	зачем нужно заказывать экологическое сопровождение
549599	ндв отказ причина	Причины отказа по НДВ
549599	ошибка пдв проект разработка	Ошибки при разработке проекта ПДВ
549599	выдача заключение мочь ндв отказывать почему экспертный	Почему могут отказать в выдаче экспертного заключения на НДВ
549599	можно ндв ошибаться разработка	В чём можно ошибиться при разработке НДВ
549600	отсутствие пдв штраф	Штрафы за отсутствие ПДВ
549600	без ндв проект работать	Если работать без проекта НДВ
549600	грозить ндв неполученный	Чем грозит неполученный НДВ
549600	ндв санкция штрафной	Штрафные санкции НДВ
549601	услуга	услуги
549601	услуга экология	услуги по экологии
549601	контрагент услуга экология	услуги контрагентов по экологии
549602	проектирование экологический	экологическое проектирование
549602	проектрирование услуга	услуги по проектрированию
549602	проект разрабатывать экология	разработать проект по экологии
549603	договор экология	договоры по экологии
549603	договор заключать какой	какие договоры заключить
549604	договор отходы	договоры по отходам
549604	договор область обращение отходы с	договоры в области обращения с отходами
549606	договор лаборатория с	договор с лабораторией
549606	договор исследование лабораторный	договор на лабораторные исследования
549584	или ндв пдв	Как правильно НДВ или ПДВ
549584	или корректный ндв пдв	Что корректней ПДВ или НДВ
549584	или ндв пдв проект проект	проект ПДВ или проект НДВ
549585	и ндв программа проект пэк	Проект НДВ и программа ПЭК
549585	взаимосвязанный и ндв программа пэк	Как взаимосвязаны НДВ и программа ПЭК
549585	ндв программа пэк расчет	Расчёты НДВ для программы ПЭК
549816	подрядчик работа с	работа с подрядчиками
549816	планирование подрядчик рабоы с	планирование рабоы с подрядчиками
554517	декларация новый плата требование	декларация о плате новые требования
554517	двос	двос
554519	воздействие декларация должный кто окружающий подавать среда	кто должен подавать декларацию о воздействии на окружающую среду
554519	двос кто подавать	кому нужно подавать двос
554519	воздействие декларация какой передавать случай	в каких случаях передавать декларацию о воздействии
554522	воздействие декларация окружающий подача среда срок	срок подачи декларации о воздействии на окружающую среду
554522	двос какой подавать срок	в какой срок нужно подать ДВОС
554526	двос куда подавать	куда подавать двос
554526	воздействие декларация куда окружающий подавать среда	куда подавать декларацию о воздействии на окружающую среду
554526	воздействие декларация куда ос подаваться	куда подается декларация о воздействии на ос
553994	ппк	ппк
553994	программа пэк разрабатывать	как разработать программу пэк
553994	контроль организовывать производственный экологический	как организовать производственный экологический контроль
553995	пэк	что такое пэк
553995	контроль производственный экологический	что такое производственный экологический контроль
553995	контроль производственный экологический это	производственный экологический контроль - это
553996	пэк срок	срок пэк
553996	когда пэк скорректировать	когда нужно скорректировать пэк
556061	локализовать нефть разлив	Как локализовать разлив нефти
556061	локализовать нефтепродукт разлив	Как локализовать разлив нефтепродуктов
556061	локализовать нефтеразлить	Как локализовать нефтеразлив
556070	и ликвидировать нефтепродукт нефть разлив	Как ликвидировать разлив нефти и нефтепродуктов
556070	ликвидация метод нефтеразлив	Методы ликвидации нефтеразливов
554502	сброс сверхлимитный	сверхлимитный сброс
554502	сверхнорматив	сверхнорматив
554502	сверхлимит	сверхлимит
554173	03 1 1386 2 7 сп	СП 2.1.7.1386-03
554173	03 1 1386 2 7 класс опасность сп	классы опасности по СП 2.1.7.1386-03
554173	03 1 1386 2 7 санпин	Санпин 2.1.7.1386-03
554530	двос заполнение	заполнение двос
554530	воздействие декларация заполнять окружающий среда	Как заполнить декларацию о воздействии на окружающую среду
554532	воздействие декларация окружающий пример среда	пример декларация о воздействии на окружающую среду
554532	двос шаблон	шаблон двос
554445	класс отходы токсичность	класс токсичности отходов
554445	5 биотестирование класс	биотестирование на 5 класс
554612	водный объект пользование разрешение	разрешение на пользование водным объектом
554612	водопользование решение	решение на водопользование
554733	ликвидация нефтепродукт план разлив	план ликвидации разливов нефтепродуктов
554733	плрн	плрн
556287	ii документ категория лист объект чек	Чек-лист документов для объектов II категории
556287	ii документ категория объект	Документы для объектов II категории
