TemplateID	LmQuery	Query
569597	безопасность бывать какой обучение пожарный программа	Какие бывают программы обучения по пожарной безопасности
569597	безопасность обучение пожарный программа	программа обучения по пожарной безопасности
569597	обучение пб программа	программы обучения пб
569599	каточка личный назначение ответственный приказ сизый учет	Приказ о назначении ответственных за учет личных каточек СИЗ
569599	выдача карточка лицо личный назначение ответственный сизый учет учет	о назначении лиц, ответственных за учет личных карточек учета выдачи сиз
569599	ведение выдача карточка назначение ответственный приказ сизый учет	приказ о назначении ответственного за ведение карточек учета выдачи сиз
569831	расследовать самоубийство	самоубийство как расследовать
569831	исход несчастный расследование случай смертельный со	расследование несчастного случая со смертельным исходом
569831	расследовать смерть	расследовать смерть
569832	использовать огнетушитель	Как использовать огнетушители
569832	научать огнетушитель пользоваться	как научить пользоваться огнетушителями
569832	использование обучать огнетушитель	как обучить использованию огнетушителей
569833	клиника контроль медицинский программа производственный	Программа производственного контроля медицинской клиники
569833	контроль медучреждение программа производственный	Программа производственного контроля медучреждение
569834	выдача дежурный норма сизый	нормах выдачи дежурных сиз
569834	дежурный загрязнение костюм норма обозначать посещение специалист участок	как в нормах обозначить дежурный костюм от загрязнений для посещения участка специалистами
569835	компания контроль программа производственный строительный	Программа производственного контроля строительной компании
569835	контроль организация программа производственный строительный	Программа производственного контроля строительной организации
569836	дежурный перевести спецодежда	как перевести спецодежду в дежурную
569836	дежурный и комиссия оформляться перевод приниматься протокол решение сизый	решение о переводе сиз в дежурные принимается комиссией и оформляется протоколом.
569837	акт дежурный перевод	акт перевода в дежурные
569837	дежурный перевод приказ сизый сизый	приказ о переводе сиз в дежурные сиз
569839	бесплатный выдаваться который лечебный перечень питание профессия профилактический работник труд условие	Перечень профессий работников, которым по условиям труда выдается бесплатное лечебно-профилактическое питание
569839	выдаваться который молоко перечень работник	Перечень работников которым выдается молоко
569841	i группа должность и перечень персонал приказ присвоение профессия утверждение электробезопасность	Приказ об утверждении перечня должностей и профессий для присвоения персоналу I группы по электробезопасности
569841	группа образец приказ присвоение электробезопасность	образец приказа о присвоения группы по электробезопасности
569841	1 группа должность приказ список утверждение	приказ об утверждении списка должностей на 1 группу
569842	пожаротушение порошковый установка	установки порошкового пожаротушения
569842	пожаротушение порошковый установка эксплуатировать	Как эксплуатировать установки порошкового пожаротушения
569842	автоматический пожаротушение	автоматическое пожаротушение
569872	газоопасный определение работа	определение газоопасных работ
569872	газоопасный работа	Что такое газоопасные работы
570114	информирование охрана порядок работник труд	Порядок информирования работников об охране труда
570114	информирование их место охрана порядок право работник рабочий труд труд трудовой условие	Порядок информирования работников об охране труда, о их трудовых правах, об условиях труда на рабочих местах
570114	информирование охрана положение работник труд	Положение об информирования работников об охране труда
569685	журнал и испытание лестница регистрация учет	журнал регистрации и учета испытаний лестниц
569685	журнал и лестница стремянка	журнал лестницы и стремянки
569687	журнал и и лес осмотр подмости прием	Журнал приема и осмотра лесов и подмостей
569687	журнал лес прием	журнал приема лесов
569687	журнал лес учет	журнал учета лесов
569688	журнал наличие первичный пожаротушение проверка средство	Журнал проверки наличия первичных средств пожаротушения
569688	журнал наличие огнетушитель проверка	Журнал проверки наличия огнетушителей
569688	журнал и осмотр первичный пожаротушение средство учет	журнал учета и осмотра первичных средств пожаротушения
569689	журнал инструмент учет	журнал учета инструмента
569689	журнал и испытание проверка учет электроинструмент	Журнал учета, проверки и испытаний электроинструмента
569690	журнал подмащивание средство учет	Журнал учета средств подмащивания
569690	и осмотр подмащивание средство учет	учета и осмотра средств подмащивания
569691	обучение опасность повышенный программа работа	Программа обучения для работ повышенной опасности
569691	безопасный выполнение и метод обучение опасность повышенный прием программа работа	программа обучения безопасным методам и приемам выполнения работ повышенной опасности
463039	назначение ответственный приказ проведение работа строительный	приказ о назначении ответственного за проведении строительных работ
463039	выполнение назначение ответственный приказ работа строительный участок	приказ о назначении ответственного при выполнении работ на строительном участке
463039	контроль лицо назначение ответственный приказ строительный	Приказ о назначении лиц, ответственных за строительный контроль
570370	2023 год мероприятие минтруда новый охрана план рекомендация труд	план мероприятий по охране труда на 2023 год по новым рекомендациям минтруда
570370	2023 год мероприятие охрана план труд	план мероприятий по охране труда на 2023 год
570370	2023 мероприятие перечень составлять	как составить перечень мероприятий на 2023
570370	2024 г мероприятие охрана план труд	план мероприятий по охране труда на 2024 г
570370	мероприятие охрана провожать труд улучшение условие	как проводить мероприятия по улучшению условий охраны труда?
570370	2023 мероприятие план специалист	план мероприятий специалиста по от на 2023
570370	включать год какой мероприятие мероприятие охрана план труд	какие мероприятия включить в план мероприятий по охране труда на следующий год?
570370	2024 год мероприятие план пр	план мероприятий пр от на 2024 года
570370	2023 год план труд улучшение условие	план по улучшению условий труд на 2023 год
570371	должный какой количество организация средство тратить	какое количество средств организация должна тратить на от
570371	охрана процент расход сколько труд	расходы на охрану труда сколько процентов
570371	должный организация охрана сколько тратить труд	сколько организация должна тратить на охрану труда
570371	должный затрата или какой коммерческий мало не организация охрана продукция производство процент работа сумма тратить труд услуга	не меньше какого процента от суммы затрат на производство продукции, работ или услуг, должны тратить коммерческие организации на охрану труда?
570028	входной закупка и контроль организовывать сизый	как организовать входной контроль и закупку сиз
570028	их порядок приобретение проверка сизый стадия	порядок проверки сиз на стадии их приобретения
570037	несчастный положение расследование случай	положение расследование несчастных случаев
570037	и ли несчастный обязывать положение работодатель разрабатывать расследование случай утверждать	Обязан ли работодатель разработать и утвердить положение о расследовании несчастных случаев?
570037	2023 несчастный положение производство расследование случай	положение о расследовании несчастных случаев на производстве на 2023
570037	несч положение расследование случай	положение по расследованию несч случаев
571346	допуск журнал наряд регистрация	Журнал регистрации нарядов-допусков
571346	журнал наряд регистрация	журнал регистрация наряд
570372	10 2021 29 771н минтруда	минтруда от 29.10.2021 № 771н
570372	771н приказ	приказ № 771н
570372	771н минтруд приказ улучшение условие	приказ минтруда 771н улучшение условий
570372	10 2021 29 771н г и минтруд приказ соцзащита	приказ минтруда и соцзащиты от 29.10.2021 г. № 771н
570372	10 2021 29 771н ежегодно мероприятие минтруд перечень приказ примерный работодатель реализовать россия труд улучшение условие утверждение	приказ минтруда россии от 29.10.2021 № 771н об утверждении примерного перечня ежегодно реализуемых работодателем мероприятий по улучшению условий труда
570372	01 03 2022 771н	771н 01.03.2022
570372	771н мероприятие минтруд охрана перечень приказ труд утверждать	перечень мероприятий по охране труда утвержденный приказом минтруда № 771н.
570372	771н изменение	771н изменения
570372	10 2021 29 771н минтруд приказ рф	минтруд рф приказом от 29.10.2021 № 771н
570372	771	771
570372	2021 29 771н октябрь приказ	приказ 771н от 29 октября 2021
570682	приказ соут	соут приказ
570682	преказ суот	преказ суот
570682	оценка приказ специальный труд условие	приказ о специальной оценке условий труда
570499	объект опасный производственный это	опасный производственный объект это
570499	опо	опо
570500	вводный инструктаж подрядчик программа	Программа вводного инструктажа по ОТ для подрядчиков
570500	вводный инструктаж организация охрана подрядный программа труд	Программа вводного инструктажа по охране труда для подрядных организаций
570500	вводный инструктаж подрядный программа работник	программа вводного инструктажа работников подрядных
570501	вводный журнал инструктаж подрядчик регистрация	Журнал регистрации вводного инструктажа подрядчиков
570501	вводный журнал инструктаж организация регистрация сторонний	Журнал регистрации вводного инструктажа сторонних организаций
570501	вводный журнал инструктаж организация охрана подрядный регистрация труд	Журнал регистрации вводного инструктажа по охране труда подрядных организаций
570505	кто несчастный организация подрядный расследовать с случай	кто расследует несчастный случай с подрядными организациями
570505	кто несчастный организация расследовать с случай сторонний	кто расследует несчастный случай с сторонними организациями
570962	2023 безопасность год действующий пожарный правило скачать	скачать действующие правила по пожарной безопасности на 2023 год
570962	безопасность какой нпа пожар применять	какие нпа применять по пожар. безопасности
570962	нпа пб	нпа по пб
570962	безопасность нпа пожарный	нпа пожарная безопасность
571710	входной журнал контроль сизый	входной контроль сиз журнал
571710	входной журнал контроль ли обязательный сизый	Обязателен ли журнал входного контроля СИЗ?
570821	инструкция охрана положение разработка труд	Положение о разработке инструкций по охране труда
570821	инструкция охрана положение порядок разработка труд	положение о порядке разработки инструкций по охране труда
570420	01 09 2023 внеплановый год инструктаж проводить с	Нужно ли проводить внеплановый инструктаж с 01.09.2023 года?
570420	01 09 2023 внеплановый или инструктаж какой можно период проводить сизый срок устанавливать	В какой срок провести внеплановый инструктаж по СИЗ? 01.09.2023? Или можно установить период?
570420	внеочередной должный кто новый обучение правило проходить	кто должен пройти внеочередное обучение по новым правилам
570427	внеплановый етна знание комиссия обучать охрана переход после применение проверка сизый требование труд	Нужно ли внепланово обучать комиссию по проверке знания требований охраны труда по вопросам применения СИЗ после перехода на ЕТН
570427	01 09 2023 внеплановый выдача г изменение комиссия обучать порядок с с связь сизый сизый учебный центр	нужно ли комиссию по сиз внепланово обучить в учебном центре в связи с изменениями порядка выдачи сиз с 01.09.2023 г.?
570427	внеплановый вступление выдача иза обучение правило проводить сизый	нужно ли провести внеплановые обучение иза вступления правил выдачи сиз
570428	аналогичный вид заменять иметь ли один право работодатель сизый	имеет ли право работодатель заменять один вид сиз на аналогичный
570428	другой замена один равноценный сизый сизый	замена одного сиз на другой равноценный СИЗ
570279	документ закупка защита индивидуальный какой проверять средство	какие документы проверить при закупке средств индивидуальной защиты
570279	документ закупка предоставлять сизый	документы предоставляемые при закупке сиз
572145	входной контроль проверять сизый	что проверить на входном контроле сиз?
570804	карточка новый переходить сизый	нужно ли переходить на новые карточки сиз
570804	вводить выдача карта ли новый обязательно с сентябрь сизый	обязательно ли вводить новые карты выдачи сиз с сентября
570804	вести выходить карточка не новый носок сизый срок	нужно ли вести новые карточку сиз если не вышел срок носки
571463	закупка отвечать охрана сизый специалист труд	закупка сиз: за что отвечает специалист по охране труда
571463	закупка обеспечение обязанность отдел работник сизый специалист	обязанности специалиста отдела закупок при обеспечении работников сиз
571463	входной контроль обязанность охрана сизый специалист труд	Специалист по охране труда обязанности по входному контролю СИЗ
570664	высота приказ работа	Приказы по работе на высоте
570664	высота приказ работа шаблон	шаблоны приказы по работе на высоте
570664	высота приказ	приказ на высоту
570829	инструкция один охрана разрабатывать труд	можно ли разработать одну инструкцию по охране труда
570829	должность инструкция ли охрана схожий труд	Нужны ли инструкции по охране труда на схожие должности
570416	выдача единый использовать не норма сизый типовой	можно ли не использовать единые типовые нормы выдачи сиз
570416	2023 31 выдача год декабрь использовать норма сизый	можно ли использовать нормы выдачи сиз до 31 декабря 2023 года
570418	выдача защита индивидуальный новшество средство	новшества в выдаче средств индивидуальной защиты
570418	новый правило сизый	сиз по новым правилам
570418	изменение с сетябрь	изменения с сетября
570418	01 09 23 с сизый	сиз с 01.09.23
570418	использование сделать сизый	что сделать для использования СИЗ
570418	1 выдавать с сентябрь сизый	Как выдавать сиз с 1 сентября?
570418	с сентябрь сизый	сиз с сентября
570400	приказ применение работник сизый	Приказ о применении работниками сиз
570400	защита индивидуальный приказ применение работник средство	Приказ о применении работниками средств индивидуальной защиты
570400	использование приказ сизый	приказ использование сиз
570401	впв требование	требования к впв
570401	внутренний водопровод противопожарный	внутренний противопожарный водопровод
570401	водопровод противопожарный	противопожарный водопровод
570402	впв инструкция эксплуатация	Инструкция по эксплуатации ВПВ
