TemplateID	LmQuery	Query
719	год журнал задание наряд сколько храниться	сколько лет хранятся журналы нарядов заданий
719	допуск журнал наряд хранение	хранение журнала нарядов допусков
719	год журнал наряд сколько храниться	сколько лет хранятся журналы нарядов
719	журнал наряд срок хранение	срок хранения журнал нарядов
2521	выбирать выбор государственный или инспектор когда наказание он охрана предупреждение руководствоваться труд чем штраф	у государственного инспектора по охране труда выбор наказания предупреждение или штраф, чем он руководствуется когда выбирает
2521	1 27 5 статья штраф	статья 5.27. 1 штрафы
2521	нарушение охрана сравнение труд штраф	сравнение штрафов на нарушение по охране труда
2521	гит невыполнение предписание сумма штраф	сумма штрафа за невыполнение предписания гит
2521	какой несоблюдение охрана срок труд штраф	какой штраф за несоблюдение сроков охраны труда
2521	гит проверка штраф	штрафы при проверки гит
8661	18 день дополнительный отпуск соглашение	дополнительное соглашение на отпуск 18 дней
8661	дополнительный отпуск соглашение	дополнительное соглашение об отпуске
8661	вредность дополнительный допы отпуск соглашение	доп. соглашение дополнительный отпуск за вредность
8661	дополнительный допы отпуск соглашение	дополнительное соглашение доп. отпуск
17470	начало приказ соут	приказ о начале соут
17470	организация оценка приказ проведение проведение специальный спецоценка труд условие	приказ об организации проведении специальной оценки условий труда на проведение спецоценки
17470	образец приказ проведение соут	приказ о проведении соут образец
17470	организация приказ проект спецоценка	проект приказа по спецоценке в организации
12402	медосмотр отстранение приказ работа	приказ об отстранении от работ по медосмотру
12402	медицинский не осмотр отстранение приказ проходить работа	приказ об отстранения от работы не прошедшего медицинский осмотр
12402	медосмотр освобождение приказ прохождение работа с связь	приказ об освобождении от работы в связи с прохождением медосмотра?
12402	медицинский не осмотр отстранять периодический проходить работник	Как отстранить работника не прошедшего периодический медицинский осмотр
12402	медосмотр наказание непройти приказ	приказ о наказании за непройденный медосмотр
12734	медосмотр перенос приказ проведение срок	приказ о переносе срока проведения медосмотра
12734	455 медосмотр перенос приказ	приказ 455 о переносе медосмотров
12734	медосмотр перенос периодический приказ прохождение срок	приказ о переносе сроков прохождения периодических медосмотров
12734	корона медосмотр отмена приказ	приказ на отмену медосмотров корон
12734	медосмотр пандемия перенос приказ с связь	приказ о переносе медосмотров в связи с пандемией
12734	медосмотр пандемия период периодический приказ	приказ о периодических медосмотрах в период пандемии
12734	01 10 2020 действие медосмотр приказ продление срок	приказ о продлении срока действия медосмотра до 01.10.2020
12396	график медосмотр обязательный периодический приказ утверждение	приказ об утверждении графика обязательного периодического медосмотра
12396	календарный медосмотр план приказ	приказ календарный план медосмотров
12846	возврат деньги медосмотр приказ	приказ о возврате денег за медосмотр
12846	возмещение медосмотр приказ работник	приказ о возмещении работникам за медосмотр
12817	внеочередной медицинский осмотр приказ	приказ на внеочередной медицинский осмотр
12817	внеплановый медосмотр приказ	приказ на внеплановый медосмотр
13160	медицинский направление новый осмотр предварительный	новое направление на предварительный медицинский осмотр
13160	29н медосмотр направление направление образец предварительный приказ	образец направления направления на предварительный медосмотр по приказу № 29н
13160	изменение медосмотр направление	направление на медосмотры изменения
13160	01 2021 28 29н г медицинский направление образец осмотр предварительный приказ прохождение	образец направления для прохождения предварительного медицинского осмотра по приказу № 29н от 28.01.2021 г
13160	медосмотр направление рекомендовать форма	рекомендуемая форма направления на медосмотр
13160	или медосмотр направление периодический предварительный	направление на предварительный или периодический медосмотр
13160	29н медосмотр направление пр	направление на медосмотр по пр.29н
13160	302 медосмотр н направление	направление на медосмотр по 302-н
13160	медосмотр направление первичный шаблон	шаблон направления на первичный медосмотр
13160	заполнение медосмотр направление образец	образец заполнения направления на медосмотр
13160	01 01 2021 г медосмотр направление с	направление на медосмотр с 01.01.2021 г.
13160	2021г медицинский направление осмотр с	направление на медицинский осмотр с 2021г.
13160	8 медицинский направление настоящий осмотр оформлять периодический порядок пункт с соответствие	направление на периодический медицинский осмотр, оформленное в соответствии с пунктом 8 настоящего порядка.
13160	должность медосмотр направление	направления на медосмотр по должностям
13160	2021 медосмотр направление периодический	направление на периодический медосмотр 2021
13160	ежегодный медосмотр направление	направление на ежегодный медосмотр
13677	выдача журнал медицинский направление осмотр предварительный учет	журнал учета выдачи направлений на предварительный медицинский осмотр
13677	выдача журнал медицинский направление осмотр	журнал выдачи направлений на медицинский осмотр
13677	журнал медосмотр периодический учет	журнал учета периодического медосмотра
13677	выдача документ журнал заводить медосмотр направление нормативный учет	завести журнал учета выдачи направлений на медосмотр нормативный документ
13677	журнал медосмотр направление регистрация типовой	типовой журнал регистрации направления на медосмотр
14269	дело отсутствие рассмотрение ходатайство	ходатайство о рассмотрении дела в отсутствии
14269	арбитраж без дело истец присутствие рассмотрение ходатайство	ходатайство арбитраж о рассмотрении дела без присутствия истца
14269	без дело заявление истец рассмотрение участие	заявление о рассмотрении дела без участия истца
14269	дело заявление ответчик отсутствие рассмотрение форма	форма заявления о рассмотрении дела в отсутствии ответчика
14269	заявление исковый истец отсутствие рассмотрение ходатайство	ходатайство о рассмотрении искового заявления в отсутствие истца
14269	адвокатский коллегия услуга цена	цены услуг адвокатской коллегии
14620	коронавирус прививка приказ	Приказ о прививках от коронавируса
14620	вакцинация направление прикз сотрудник	прикз о направлении сотрудников на вакцинацию
14620	вакцинация приказ	приказ о вакцинации
16873	излучение соут электромагнитный	электромагнитное излучение соут
16873	измерять спецоценка	что измеряют при спецоценке
16873	процесс соут трудовой тяжесть	тяжесть трудового процесса соут
16873	и освещенность проведение световой соут среда	освещенность и световая среда при проведении соут
16873	вредный соут фактор	вредные факторы соут
17443	выплата и льгота приказ результат соут устанавливать	приказ установить выплаты и льготы по результатам соут
17443	допы итог отпуск приказ соут	приказ по итогам соут доп. отпуск
17443	льгота назначение приказ результат соут	приказ о назначении льгот по результатам соут
17443	перерыв предоставление приказ регламентировать результат соут	приказ о предоставлении регламентированных перерывов по результатам соут
17443	выдача молоко основание приказ спецоценка	приказ о выдаче молока на основании спецоценки
17443	выплата назначение приказ результат спецоценка	приказ о назначении выплат по результатам спецоценки
17443	гарантия и компенсация назначение приказ результат соут	приказ о назначении компенсации и гарантий по результатам соут
17430	комиссия приказ соут	приказ комиссия соут
17430	комиссия приказ создание спецоценка труд условие	приказ о создании комиссии на спецоценку условий труда
17430	комиссия приказ проведение проект создание соут	проект приказа о создании комиссии для проведения соут
17430	бланк комиссия приказ создание спецоценка	бланк приказа по созданию комиссии по спецоценке
17430	комиссия образец приказ создание соут	приказ о создании комиссии по соут образец
17430	действовать комиссия постоянно приказ создание соут	приказ о создании постоянно действующей комиссии соут
17465	должность изменение название приказ спецоценка	при изменении названия должности приказ о спецоценке
17465	должность изменение название приказ соут	приказ для соут изменение название должностей
17465	внеплановый основание отсутствие приказ проведение соут	приказ об отсутствии оснований для проведения внеплановой соут.
19866	11 аренда договор месяц соут	соут договор аренды 11 месяцев
19866	договор нет спецоценка	если нет спецоценки как договор
19866	договор проведение регистрация соут	регистрация договора на проведение соут
19867	комиссия положение проведение спецоценка труд условие	положение о комиссии по проведению спецоценки условий труда
19867	комиссия положение проведение соут	положение о комиссии по проведению соут
32384	ввод и медицинский осмотр периодический положение предварительный приказ проведение работник	приказ о вводе положение о проведении предварительного и периодического медицинских осмотров работников
32384	медосмотр положение порядок приказ прохождение утверждение	приказ о об утверждении положения о порядке прохождения медосмотров
32298	защита и индивидуальный коллективный конкретный место рабочий средство	средства коллективной и индивидуальной защиты на конкретном рабочем месте
32298	быть защита коллективный ли сизый средство	нужны ли сиз если есть средства коллективной защиты
33118	бот галоша диэлектрический журнал защита испытание перчатка резина средство	журнал испытаний средств защиты из диэлектрической резины (перчаток, бот, галош)
33118	бот галоша диэлектрический документ журнал защита испытание какой перчатка резина средство	каким документом журнал испытаний средств защиты из диэлектрической резины (перчаток, бот, галош)
35493	лицо назначение ответственный приказ реагирование чс	приказ о назначении ответственного лица по реагированию на чс
35493	назначение ответственный приказ чс	приказ о назначению ответственного за чс
35493	гражданский назначение оборона ответственный приказ	приказ назначении ответственного по гражданской обороне
36646	го журнал и инструктаж чс	журнал инструктажа по го и чс
36646	действие журнал заполнение инструктаж образец чрезвычайный	образец заполнения журнала инструктажа по действиям в чрезвычайных ситуациях
37207	входной и контроль приемка	входного контроля и приемки
37207	входной журнал контроль	журнал входного контроля
37207	входной и конструкция контроль материал учет	учета входного контроля материалов и конструкций
38452	грузопогрузочный ответственный приказ работа	приказ ответственный за грузопогрузочные работы
38452	лицо назначение ответственный погрузочный приказ работа разгрузочный	приказ о назначении ответственных лиц за погрузочно-разгрузочные работы
38452	ggh j назначение ответственный приказ	приказ j назначении ответственного за ggh
38453	лицо ответственный приказ работа сварочный	приказ лицо ответственное за сварочные работы
38453	ответственный приказ работа сварочный	приказ ответственный сварочные работы
37638	2019 58758 гост р	гост р 58758-2019.
37638	2019 58758 гост и лестница монтажный национальный общий площадка р работа российский стандарт строительный технический условие федерация	гост р 58758-2019. национальный стандарт российской федерации. площадки и лестницы для строительно-монтажных работ. общие технические условия
37638	26887 86 гост	гост 26887-86.
38442	идентификация назначение ответственный приказ	приказ об назначении ответственных по идентификации
38442	ответственный приказ профессиональный риск	приказ об ответственном за профессиональные риски
38446	ответственный приказ противогаз содержание	приказ об ответственном за содержание противогазов
38446	лицо назначение ответственный приказ противогаз	приказ о назначении лиц, ответственных за противогазы
38439	коронавирус назначение ответственный приказ	приказ о назначении ответственных по коронавирусу
38439	коронавирус мероприятие назначение осуществление ответственный приказ противоэпидемический с санитарный связь	приказ о назначении ответственного за осуществление санитарно-противоэпидемических мероприятий в связи с коронавирусом
39107	выходной день ответственный приказ	приказ на ответственных в выходные дни
39107	день лицо назначение ответственный праздничный приказ	приказ о назначении ответственных лиц в праздничные дни
42104	020 12 3 80 гост ссбт	гост 12.3.020-80 ссбт
42104	009 12 3 76 безопасность безопасность вводить гост государственный действие общий погрузочный постановление работа разгрузочный система ссср стандарт стандарт требование труд	государственный стандарт ссср гост 12.3.009-76 система стандартов безопасности труда. работы погрузочно-разгрузочные. общие требования безопасности (введен в действие постановлением
42104	009 01 07 12 1976 3 76 гост	гост 12.3.009-76 от 01.07.1976
42091	2019 58752 гост р	гост р 58752-2019
42091	2019 58752 гост общий подмащивание р средство технический условие	гост р 58752-2019 средства подмащивания. общие технические условия
42077	знание и обучение охрана перенос приказ проверка срок труд	приказ о переносе сроков обучения и проверки знаний по охране труда
42077	знание и обучение охрана перенос приказ проверка работник труд	приказ о переносе проверки знаний и обучении работников по охране труда
42980	1 группа знание и и инструктаж не обучение персонал персонал проверка электробезопасность электротехнический электротехнический электротехнологический	обучение и проверка знаний электротехнического и электротехнологического персонала, инструктаж не электротехнического персонала на 1 группу по электробезопасности
42980	i группа обучение программа электробезопасность	программа обучения по электробезопасности i группа
42980	1 группа инструктаж какой присвоение программа программа разрабатываться с цель электробезопасность	подскажите, по какой программе разрабатывается программа для инструктажа с целью присвоения 1 группы по электробезопасности
42980	1 группа обучение программа электробезопасность	программа обучения 1 группа по электробезопасности
42980	1 группа кто неэлектротехнич персонал присвоение программа электробезопасность	программа присвоения 1 группы по электробезопасности неэлектротехниче кому персоналу
