TemplateID	LmQuery	Query
464846	инструктаж механосборочный программа работа слесарь	программа инструктажа для слесаря механосборочных работ
464846	проведение программа	программа проведения
464846	и инженер инструктаж обслуживание первичный программа система управление	программа первичного инструктажа для инженера по управлению и обслуживанию систем
464846	инструктаж подсобный программа рабочий	программа инструктажа подсобный рабочий
464846	водитель инструктаж первичный погрузчик программа фронтальный	программа первичного инструктажа водителя фронтального погрузчика
464846	инструктаж котельный оператор программа	программа инструктажа для оператора котельной
464846	и первичный повторный программа тест формовщик	программа первичного и повторного для формовщика теста
467083	вводный инструктаж организация приказ	приказ об организации вводного инструктажа
467083	вводный инструктаж приказ проведение	приказ о проведении вводного инструктажа
467460	иметь инструктаж кто место охрана право проводить рабочий труд	кто имеет право проводить инструктаж по охране труда на рабочем месте
467460	должный инструктаж кто проводить	кто должен проводить инструктажи по от
467460	инструктаж кто первичный повторный проводить целевой	кто проводит инструктаж первичный, повторный, целевой
467460	инструктаж место ответственный рабочий	ответственный за инструктаж на рабочем месте
467460	должный инструктаж кто организация охрана проводить труд	кто в организации должен проводить инструктажи по охране труда
471763	внеплановый инструктаж кто проводить противопожарный	кто проводит внеплановый противопожарный инструктаж
471763	безопасность инструктаж кто пожарный проводить	кто проводит инструктажи по пожарной безопасности
471763	1 безопасность вводный иметь инструктаж кто март пожарный право с читать	кто имеет право читать вводный инструктаж по пожарной безопасности с 1 марта
471763	иметь инструктаж кто пожарный право проводить	кто имеет право проводить пожарный инструктаж
471763	безопасность инструктаж ответственный пожарный провожать	может ли ответственный по пожарной безопасности проводить инструктажи
471764	безопасность вид инструктаж какой пожарный	какие виды инструктажей по пожарной безопасности
471764	вид инструктжей противопожарный	виды противопожарных инструктжей
471764	инструктаж противопожарный	противопожарные инструктажи
471765	инструктаж новый первичный правило проводить противопожарный	как провести первичный противопожарный инструктаж по новым правилам
471765	инструктаж первичный проводить противопожарный	Как провести первичный противопожарный инструктаж
471766	01 03 безопасность вводный инструктаж пожарный после	вводный инструктаж по пожарной безопасности после 01.03
471766	вводный инструктаж проведение противопожарный	проведения вводного противопожарного инструктажа
471766	2022 безопасность вводный год инструктаж март пожарный с	вводный инструктаж по пожарной безопасности с марта 2022 года
471766	безопасность вводный инструктаж офисник пожарный	вводный инструктаж по пожарной безопасности офисников
471766	вводный инструктаж когда пожарный проходить	когда проходят вводный инструктаж по пожарной
471766	вводный	вводный по
556117	выдача дерматологический расчетчик сизый	расчетчик выдачи дерматологических сиз
556117	выдача сервис смывать средство	Сервис по выдаче смывающих средств
556117	расчетчик смывать	расчетчик смывающих
471762	инструктаж пб периодичность проведение	периодичность проведения инструктажей по ПБ
471762	безопасность инструктаж пожарный частота	частота инструктажа по пожарной безопасности
471762	инструктаж пожарный проводить часто	как часто проводить инструктаж по пожарной
471762	безопасность инструктаж какой периодичность пожарный проводить с	с какой периодичностью проводить инструктаж по пожарной безопасности
471758	безопасность инструктаж офисный пожарный работник	инструктажи по пожарной безопасности для офисных работников
471758	03 1 22 безопасность инструктаж пожарный	1.03.22 инструктаж по пожарной безопасности
471758	безопасность инструктаж новый пожарный правило провожать	как проводить инструктаж по пожарной безопасности по новым правилам
471758	безопасность инструктаж какой пожарный проводить профессия	инструктаж по пожарной безопасности каким профессиям проводить
471758	инструктаж новый правило проведение работник с склад	проведения инструктажей с работниками склада по новым правилам
471758	1 2 безопасность безопасность весь должный допускаться и инструктаж мера мера обучение обучение осуществляться пожарный пожарный после предприятие прохождение работа работник работник	1.2. все работники предприятия должны допускаются к работе после прохождения инструктажа и обучения мерам пожарной безопасности. обучение работников мерам пожарной безопасности осуществляется
471759	безопасность внеплановый инструктаж пожарный содержание	содержание внепланового инструктажа по пожарной безопасности
471759	инструктаж противопожарный содержание целевой	содержание целевого противопожарного инструктажа
471770	2022 безопасность внеочередной изменение инструктаж пожарный	внеочередной инструктаж изменения пожарной безопасности в 2022
471770	внеочередной инструктаж когда проводить противопожарный	когда проводят внеочередной противопожарный инструктаж
471767	инструктаж повторный проводить противопожарный	Как провести повторный противопожарный инструктаж
471767	1 весь деятельность защита или или инструктаж лицо не объект осуществлять повторный полгода предназначать проводить проживание противопожарный раз редко служебный со трудовой	­проводить повторный противопожарный инструктаж не реже 1 раза в полгода со всеми лицами, осуществляющими трудовую или служебную деятельность на объектах защиты, предназначенных для проживания или
471767	безопасность инструктаж периодичность повторный пожарный	повторный инструктаж по пожарной безопасности периодичность
471768	гост журнал инструктаж противопожарный	гост журнала противопожарных инструктажей
471768	журнал инструктаж противопожарный т учет	журнал учета противопожарных инструктажей т
471769	безопасность инструктаж пожарный целевой	целевой инструктаж по пожарной безопасности
471769	инструктаж обучение перечень программа противопожарный случай целевой	перечень случаев обучения по программам целевого противопожарного инструктажа
473704	микротравма особенность положение расследование студент	положение об особенностях расследования микротравм студентов
473704	инструкция микротравма работник учет	инструкция по учету микротравм работников
473704	2022 микротравма особенность положение расследование	положение об особенностях расследования микротравм 2022
473704	микротравма образец положение расследование шаблон	образец шаблона положения о расследовании микротравм
473704	микроповреждение микротравма положение работник учет	положение по учету микроповреждений (микротравм) работников
473704	микротравма положение	положение о микротравмах
473829	приказ стажировка	приказ о стажировка
473829	вновь назначение приказ принятый работник стажировка	Приказ о назначении стажировки вновь принятому работнику
473829	назначение распоряжение стажировка	распоряжения о назначении стажировки
474295	лист стажировочный шаблон	шаблон стажировочного листа
474295	лист стажировочный	стажировочный лист для
474295	2464 лист стажировочный	стажировочный лист 2464
474295	водитель грузовой лист стажировочный	стажировочный лист для водителя грузового
474295	лист место рабочий стажировочный	стажировочный лист на рабочем месте
474298	1 вред зависимость защита индивидуальный который навык перечень практический применение причинение работник работник риск средство степень требовать	1. перечень средств индивидуальной защиты, применение которых требует от работников практических навыков в зависимости от степени риска причинения вреда работнику
474298	который навык перечень практический применение сизый требовать	перечень сиз, применение которых требует практических навыков
474298	защита индивидуальный который навык перечень практический применение работник средство требовать	перечень средств индивидуальной защиты, применение которых требует от работника практических навыков
473694	вводный инструктаж ответственный приказ проведение	приказ на ответственного за проведение вводного инструктажа
473694	вводный инструктаж охрана приказ проведение труд	приказ о проведении вводного инструктажа по охране труда
473694	kbw вводный инструктаж назначение ответственный предприятие приказ проведение	приказ назначение ответственных kbw за проведение вводного инструктажа на предприятии
473696	окружающий ответственный охрана предприятие среда	ответственный за охрану окружающей среды на предприятии
473696	окружающий ответственный охрана среда	ответственный за охрану окружающей среды
473697	ответственный электрохозяйство	ответственны за электрохозяйство
473697	быть должный кто ответственный школа электрохозяйство	кто должен быть ответственный за электрохозяйство по школе
473698	грузоподъемный кран ответственный ответственный пс работоспособный содержание состояние специалист	ответственные за грузоподъемные краны специалист, ответственный за содержание пс в работоспособном состоянии
473698	безопасный кран ответственный применение производство работа с	ответственный за безопасное производство работ с применением кранов
473698	безопасный ответственный пс содержание	ответственные за безопасное содержание пс
473698	ответственный подъемный	ответственный за подъемные
473698	безопасный быть кто мочь ответственный применение производство пс работа с специалист	кто может быть специалистом ответственным за безопасное производство работ с применением пс
473698	гпм ответственный пол с	гпм с пола ответственные
473693	ген дира назначать ответсвенный охрана труд	можно ли назначить ген дира ответсвенным за охрану труда
473693	ответственность охрана работодатель труд	ответственность работодателя по охране труда
473693	ответственный охрана труд	ответственного за охрану труда
473693	без назначать образование ответственный охрана труд ха	можно ли назначить ответственным ха охрану труда без образования
473693	компания кто ответственный охрана труд	кто ответственный за охрану труда в компании
473693	быть кто мочь ответственный охрана труд	кто может быть ответственным по охране труда
474518	комиссия несчастный расследование случай создание	о создании комиссии по расследованию несчастного случая
474518	действовать комиссия несчастный постоянно приказ расследование случай	приказ о постоянно действующей комиссии по расследованию несчастных случаев
474518	комиссия организация приказ расследование создание	Приказ о создании комиссии по расследованию в организации
474518	комиссия легкий несчастный приказ расследование случай создание	приказ о создании комиссии для расследования легкого несчастного случая
474518	комиссия лагерь летний несчастный пдк пребывание приказ расследование ребенок случай создание	приказ о создании пдк комиссии по расследованию несчастных случаев в летнем лагере пребывания детей
474518	комиссия несчастный приказ расследование случай создание тяжелый	приказ о создании комиссии по расследованию тяжелого несчастного случая
474518	комиссия несчастный приказ случай	приказ о комиссии о несчастном случаи
474600	вводный инструктаж новый охрана правило программа труд	программа вводного инструктажа по охране труда по новым правилам
474600	09 1 2022 вводный инструктаж с	вводный инструктаж по от с 1.09.2022
474600	2464 вводный инструктаж новый охрана постановление программа труд	программа вводного инструктажа по охране труда по новому постановлению 2464
474600	1 2022 вводный инструктаж охрана программа с сентябрь труд	программа вводного инструктажа по охране труда с 1 сентября 2022
474600	вводный инструктаж офисный работник	вводный инструктаж для офисного работника
474600	вводный инструктаж проведение программа	программа для проведения вводного инструктажа
567393	новое октябрь2023	новое октябрь2023
567393	главный новость октябрь	главные новости октября
478564	кассетник место программа рабочий сортировщик стажировка	программы стажировки на рабочем месте сортировщика-кассетника
478564	2464 место проведение программа рабочий стажировка	программа проведения стажировки на рабочем месте по 2464
478564	программа ручной стажировка формовка формовщик	программа стажировки для формовщика ручной формовки
478564	выпуск линия механика программа стажировка	программа стажировки механика по выпуску на линию
478564	оцинковщик программа стажировка	программа стажировки для оцинковщика
478564	проведение программа стажировка электрослесарь	программа проведения стажировки для электрослесаря
478564	1 2464 высота группа й место обучение порядок программа работа работник рабочий стажировка	программа стажировки на рабочем месте при работе на высоте для работников 1-й группы по порядку обучения № 2464
478564	программа рабочий ремонт стажировка текущий	программа стажировки рабочего по текущему ремонту
478564	монтировщик программа стажировка шина	программа стажировки для монтировщика шин
478564	место оператор охрана пост программа рабочий стажировка	программа стажировки на рабочем месте для оператора поста охраны
478564	благоустройство населенный программа пункт рабочий стажировка	программа стажировки рабочего по благоустройству населенных пунктов
478564	горнорудный конвейер машинист программа пром стажировка	программа стажировки машиниста конвейера горнорудная пром.
478564	музыкальный программа руководитель стажировка	программа стажировки для музыкального руководителя
478564	и инженер программа радио средство стажировка телевидение	программа стажировки инженера средств радио и телевидения
478564	и место обслуживание программа рабочий ремонт стажировка электромонтер	программа стажировок на рабочем месте электромонтера по ремонту и обслуживанию
478564	машинист погрузчик программа стажировка	программа стажировки для машиниста погрузчика
478564	программа стажировка уборщица	программа стажировки уборщицы
478564	газ добыча и нефть оператор программа стажировка	программа стажировки для оператор по добыче нефти и газа
478564	бульдозерист новый порядок программа стажировка	программы стажировки для бульдозериста по новому порядку
478564	маляр программа стажировка	программа стажировки маляра
478564	ас инженер программа стажировка	программа стажировки инженера асу
478564	а и кип программа слесарь стажировка	программа стажировки слесаря кип и а
