TemplateID	LmQuery	Query
35493	гочс назначение ответственный приказ	приказ о назначении ответственного за гочс
35493	назначение ответственный приказ чс	приказ о назначению ответственного за чс
35493	гражданский назначение оборона ответственный приказ	приказ назначении ответственного по гражданской обороне
36646	гражданский журнал и оборона чрезвычайный	журнал по гражданской обороне и чрезвычайным ситуациям
36646	го журнал и инструктаж чс	журнал инструктажа по го и чс
42980	1 гр обучение программа электробезопасность	программа обучения по электробезопасности 1 гр
42980	1 c билет группа инструктаж неэлектротехнический персонал проведение программа экзаменационный	программа проведения инструктажа неэлектротехнического персонала на 1 группу c экзаменационными билетами
42980	1 группа инструктаж присвоение программа электробезопасность	программа инструктажа по присвоению 1 группы по электробезопасности
42980	1 группа обучение программа электробезопасность	программа обучения 1 группа по электробезопасности
42980	i группа инструктаж программа электробезопасность	программу инструктажа на i группу по электробезопасности
42980	неэлектротехнический обучение персонал программа	программа обучения для неэлектротехнического персонала
42980	группы1 неэлектрический персонал присвоение программа электробезопасность	программа на присвоение группы1 по электробезопасности неэлектрическому персоналу
42980	группа обучение охрана первый присвоение программа труд электробезопасность	программ обучения по охране труда по присвоению первой группы по электробезопасности
42980	1 группа обучение электробезопасность	обучение 1 группе электробезопасности
44316	высота журнал осмотр сизый	журнал осмотра сиз от высоты
44316	782н высота д допуск журнал журнал и наряд осмотр периодический приказ работа работа сизый т учет	журналы по периодическому осмотру сиз, журналы по учету работ по наряду-допуску и т.д.) при работе на высоте по приказу № 782н
45177	лицо назначение ответственный приказ проведение пэк	приказ о назначении лица, ответственного за проведение ПЭК
45177	и контроль лицо назначение организация ответственный правило проведение производственный санитарный соблюдение	о назначении лиц, ответственных за организацию и проведение производственного контроля соблюдения санитарных правил
397691	положение профессиональный риск система	положение о системе профессиональных рисков
397691	положение профессиональный риск система управление	положение система управления профессиональными рисками
398174	грузозахватный журнал и и осмотр периодический приспособление съемный тара учет	журнал учета и периодических осмотров съемных грузозахватных приспособлений и тары
398174	и осмотр сгзп тара	осмотр сгзп и тары
422617	вредный выдаваться действие допуск или какой место наряд опасный срок фактор	на какой срок выдается наряд-допуск в местах действия опасных или вредных факторов
422617	выдача наряд срок электробезопасность	срок выдачи наряда по электробезопасности
422617	выдаваться допуск какой наряд срок	на какой срок выдается наряд-допуск
422617	выдаваться допуск наряд сколько	на сколько выдается наряд допуск
422617	наряд срок	наряд срок
422617	5 более действие день допуск наряд не срок	срок действия наряда-допуска не более 5 дней
33646	медицинский осмотр список	список на медицинский осмотр
33646	01 2021 28 29н контингент медосмотр основание приказ форма	формы контингента по медосмотрам на основании приказа № 29н от 28.01.2021
576996	верно гидравлический испытание какой перечисленный проведение сосуд требование указывать	Какое из перечисленных требований при проведении гидравлического испытания сосудов указано верно?
581722	опасность опо признак	признаки опасности опо
581722	опасность признак	признак опасности
577013	быть вырезать должно и исследование каждый какой количество контроль контрольный металлографический низколегированный образец сварной сварной соединение соединение становиться стыковой углеродистый	Какое количество образцов должно быть вырезано из каждого контрольного стыкового сварного соединения для металлографических исследований при контроле сварных соединений из углеродистой и низколегированной стали
422450	машиностроение область перечень профессия профстандарт	перечень профессий по профстандарту в области машиностроения
422450	перечень профстандарт	профстандарт перечень
422619	выдавать допуск кто наряд огневой предприятие работа	кто на предприятии выдает наряд-допуск на огневые работы
422619	выдавать высота допуск кто наряд	кто выдает наряд-допуск на высоте
422619	выдавать допуск кто наряд подрядчик	кто выдает наряд-допуск подрядчику
422619	быть выдавать иметь кто наряд право эу	кто имеет право быть выдающим наряд в эу
422619	допуск кто наряд подписывать	кто подписывает наряд-допуск
422619	выдача допуск наряд право	о праве выдачи нарядов-допусков.
422619	выдавать допуск кто наряд работа совмещать	кто выдает наряды-допуски на совмещенные работы?
422619	допуск допускать жилищный коммунальный кто наряд опасность повышенный производство работа хозяйство	кто такой допускающий в наряд-допуске на производство работ повышенной опасности в жилищно-коммунальном хозяйстве
422619	выдача допуск лицо наряд ответственный	ответственное лицо за выдачу наряда допуска
422619	выдавать должный допуск кто наряд огневой	кто должен выдавать наряд-допуск на огневые
422620	допуск закрытый наряд срок хранение	срок хранения закрытого наряда-допуска
422620	допуск наряд огневой работа хранение	хранение наряд-допуска на огневые работы
422620	допуск наряд огневой работа сколько храниться	сколько хранится наряд-допуск на огневые работы
422620	допуск журнал наряд регистрация срок хранение	срок хранения журнала регистрации нарядов допусков
422618	должность допуск какой можно назначать наряд производитель работа работник	работников каких должностей можно назначать производителями работ по наряду-допуску
422618	допуск и наряд производитель работа руководитель	производитель и руководитель работ наряд-допуск
432370	вводный журнал инструктаж противопожарный форма	форма журнала вводного противопожарного инструктажа
432370	безопасность вводный журнал заполнение и инструктаж новый первичный пожарный пример форма	пример заполнения журнала инструктажа по пожарной безопасности новая форма вводного и первичного
432370	2022 безопасность год журнал инструктаж пожарный регистрация	журнал регистрации инструктажа по пожарной безопасности в 2022 году
432370	безопасность журнал инструктаж место пожарный рабочий учет	журнал учета инструктажей по пожарной безопасности на рабочем месте
432370	1 2022 безопасность журнал инструктаж март пожарный регистрация с	с 1 марта 2022 журнал регистрации инструктажей по пожарной безопасности
432370	806 безопасность журнал заполнение инструктаж пожарный приказ пример проведение с соответствие	пример заполнения журнала проведения инструктажей по пожарной безопасности в соответствии с приказом № 806
432679	2022 безопасность вводный год инструктаж новый пожарный правило программа	программ вводного инструктаж по пожарной безопасности по новым правилам 2022 год
432679	безопасность вводный инструктаж пожарный программа	программа вводного инструктажа пожарная безопасность
432679	безопасность вводный и инструктаж образец охрана пожарный программа труд	образец программа вводного инструктажа по охране труда и пожарной безопасности
432679	вводный инструктаж новый программа противопожарный требование	программа вводного противопожарного инструктажа по новым требованиям
432679	безопасность вводный инструкция пожарный	инструкция по пожарной безопасности вводного
432855	безопасность внеочередной инструктаж пожарный программа	программа внеочередного инструктажа по пожарной безопасности
432855	01 03 22 безопасность внеочередной инструктаж инструкция пожарный проведение с	инструкция для проведения внеочередного инструктажа по пожарной безопасности с 01.03.22
432855	1 безопасность внеплановый изменение инструктаж март пожарный программа с	программа внепланового инструктажа по пожарной безопасности изменения с 1 марта
438093	опасность повышенный работа	работы повышенной опасности
438093	опасность перечень повышенный работа с	перечень работ с повышенной опасностью
438093	2464 весь опасность перечень повышенный работа	перечень всех работ повышенной опасности 2464
438093	вид опасность повышенный программа работа	виды работ повышенной опасности по программе в
438106	инструкция приказ утверждение	приказ об утверждении инструкций
438106	01 1 2023 вступать инструкция новый ознакомление приказ с с	приказ по ознакомлению с новыми инструкция вступающими с 1.01.2023
576652	быть возможность какой мочь опытный организация период применение принимать режим решение руководитель сосуд эксплуатация эксплуатировать	На какой период руководителем эксплуатирующей организации может быть принято решение о возможности эксплуатации сосуда в режиме опытного применения?
576654	100 баллон вместимость или кроме литр наноситься не не они приводить пуск работа сосуд табличка транспортировать указываться	Что из приведенного не указывается на табличке или не наносится на сосудах (кроме транспортируемых баллонов вместимостью до 100 литров) перед пуском их в работу?
576653	включение документ и какой основание остановка осуществляться пуск работа сосуд штатный	На основании какого документа осуществляется пуск (включение) в работу и штатная остановка сосуда
442107	выдача и инструкция организация охрана пересмотр порядок приказ применение разработка труд хранение	приказ об организации порядка разработки, применения, пересмотра, хранения и выдачи инструкций по охране труда
442107	инструкция охрана пересмотр приказ труд	приказ о пересмотре инструкций по охране труда
442662	пмло	пмла
442662	авария и ликвидация локализация мероприятие объект опасный план последствие производственный	планов мероприятий по локализации и ликвидации последствий аварий на опасных производственных объектах
444664	аптечка приказ	приказ аптечка
444664	аптечка комплектация обеспечение оказание первый помощь приказ работник	Приказ об обеспечении комплектации аптечек для оказания первой помощи работникам
446516	допуск наряд опасность повышенный производство работа	Наряд-допуск на производство работ повышенной опасности
446516	допуск наряд опасность повышенный работа	наряд-допуска на работы повышенной опасности
446517	допуск наряд электроустановка	наряд-допуск в электроустановках
446517	наряд работа электроустановка	наряд работы в электроустановках
446083	медицинский осмотр периодический подлежать поименный работник список	поименный список работников, подлежащих периодическим медицинским осмотрам
446083	поименный список	Поименный список
448552	план эвакуация	планы эвакуации
448552	и план пожар чс эвакуация	план эвакуации при пожаре и чс
448552	выглядеть должный план эвакуация	план эвакуации как должен выглядеть
448552	план требование эвакуация	требования к планам эвакуации
454002	лицо осмотр подлежать поступать предварительный работа список	Список лиц, поступающих на работу, подлежащих предварительным осмотрам
454002	медосмотр первичный список	список на первичный медосмотр
566524	документ какой объект обязательный опасный оценка применять производственный соответствие технический требование устанавливаться устройство форма	В каких документах устанавливаются формы оценки соответствия обязательным требованиям к техническим устройствам, применяемым на опасном производственном объекте?
463044	испытание лестница	испытания лестниц
463044	испытание лестница стремянка	испытания лестниц стремянок
463044	испытание лестница приставной	испытание приставных лестниц
467083	вводный инструктаж приказ	приказ о вводном инструктаже
467083	вводный инструктаж приказ прохождение	приказ о прохождении вводного инструктажа
566530	и и или машина не оборудование определяться перечисленный проектирование разработка	Что из перечисленного не определяется при разработке и проектировании машины и (или) оборудования
471763	безопасность инструктаж непосредственный пожарный проводить руководитель	может ли непосредственный руководитель проводить инструктаж по пожарной безопасности
471763	инструктаж кто первичный проводить противопожарный	кто проводит первичный противопожарный инструктаж
471763	безопасность должный инструктаж кто пожарный проводить	кто должен проводить инструктаж по пожарной безопасности
471763	инструктаж кто пб проводить	кто проводит инструктаж по пб
471763	безопасность вводный иметь инструктаж кто пожарный право читать	кто имеет право читать вводный инструктаж по пожарной безопасности
471764	безопасность вид инструктаж какой пожарный	какие виды инструктажей по пожарной безопасности
471764	инструктаж противопожарный	противопожарные инструктажи
471764	вид инструктжей противопожарный	виды противопожарных инструктжей
471765	2022 безопасность инструктаж новое первичный пожарный	первичный инструктаж по пожарной безопасности по новому 2022
471765	инструктаж первичный проводить противопожарный	Как провести первичный противопожарный инструктаж
471766	безопасность вводный инструктаж новое пожарный проходить	как проходит вводный инструктаж по пожарной безопасности по новому
471766	вводный	вводный по
471766	2022 безопасность вводный год инструктаж март пожарный с	вводный инструктаж по пожарной безопасности с марта 2022 года
471766	вводный инструктаж кто проводиться противопожарный с	с кем проводится вводный противопожарный инструктаж
471766	вводный инструктаж когда пожарный проходить	когда проходят вводный инструктаж по пожарной
471766	вводный инструктаж проведение противопожарный	проведения вводного противопожарного инструктажа
540187	обучение протокол электробезопасность	протокол обучения электробезопасности
540187	2023 знание образец проверка протокол электробезопасность	протокол проверки знаний по электробезопасности образец 2023
540187	аттестация внутри комиссия протокол свой электробезопасность	протокол аттестации по электробезопасности внутри своей комиссии
540187	2 3 группа и протокол электробезопасность	протокол по электробезопасности на 3 и 2 группу
471759	безопасность внеплановый инструктаж пожарный содержание	содержание внепланового инструктажа по пожарной безопасности
471759	безопасность инструктаж пожарный содержание целевой	содержание целевого инструктажа по пожарной безопасности
471762	безопасность инструктаж проведение противопожарный срок	сроки проведения инструктажей по противопожарной безопасности
