TemplateID	LmQuery	Query
563984	вводный журнал инструктаж проведение форма	Форма журнала проведения вводного инструктажа
563984	вводный журнал инструктаж охрана труд	журнал вводного инструктажа по охране труда
565213	безопасный организовывать работа электрогазосварщик	Как организовать безопасную работу электрогазосварщиков
565213	аттестация электрогазосварщик	аттестация электрогазосварщика
565238	выдача дерматологический защита норма средство шаблон	шаблон норм выдачи дерматологических средств защиты
565238	выдача норма образец смывать	нормы выдачи смывающих образец
565238	выдача дерматологический и норма приказ сизый смывать средство утверждение	приказ об утверждении норм выдачи дерматологических сиз и смывающих средств
565238	выдача и норма приказ сизый смывать утверждение	приказ утверждение норм выдачи сиз и смывающих
565238	766н смывать форма	форма смывающих 766н
565238	выдача дерматологический норма сизый шаблон	нормы выдачи дерматологических сиз шаблон
565238	бесплатный выдача и норма обезвреживать образец работник смывать средство	образец норм бесплатной выдачи работникам смывающих и обезвреживающих средств
564446	оборудование ответственный приказ	приказ ответственного за оборудование
564446	назначение оборудование ответственный приказ	приказ о назначении ответственного за оборудование
564446	и назначение оборудование ответственный приказ производственный состояние технический эксплуатация	приказ о назначении ответственных за техническое состояние и эксплуатацию производственного оборудования
564455	и исправность лицо назначение ответственный приказ сохранность электроинструмент	Приказ о назначении ответственного лица за сохранность и исправность электроинструмента
564455	исправность ответственный электрооборудование	Ответственный за исправность электрооборудования
564455	исправность лобзик ответственный	Ответственный за исправность лобзиков
565895	1 а аттестация внимание обращать подготовка	на что обратить внимание при подготовке к аттестации а.1
565895	1 а аттестация подготавливаться	как подготовиться к аттестации по А.1
566025	быть группа должный какой охрана специалист труд электробезопасность	какая группа по электробезопасности должна быть у специалиста по охране труда
566025	группа какой сота электробезопасность	Какая группа по электробезопасности нужна СОТу
566452	07 116 1997 21 безопасность входить закон инцидент объект опасный понятие производственный промышленный с соответствие федеральный фз	Что входит в понятие «инцидент» в соответствии с Федеральным законом от 21.07.1997 № 116-ФЗ «О промышленной безопасности опасных производственных объектов»
566454	07 116 1997 21 безопасность закон какой норма объект опасный организация производственный промышленный распространяться федеральный фз	На какие организации распространяются нормы Федерального закона от 21.07.1997 № 116-ФЗ «О промышленной безопасности опасных производственных объектов»
566455	07 116 1997 21 безопасность безопасность закон объект опасный пониматься производственный промышленный промышленный с соответствие требование федеральный фз	Что понимается под требованиями промышленной безопасности в соответствии с Федеральным законом от 21.07.1997 № 116-ФЗ «О промышленной безопасности опасных производственных объектов»
563806	карта технологический элеватор	технологические карты на элеваторе
563806	и карта порядок разработка технологический утверждение	порядок разработки и утверждения технологической карты
563806	карта необходимость обоснование объект опасный производственный технологический	обоснование необходимости технологических карт на опасном производственном объекте
563806	карта корпус погрузочный подъемный применение производственный работа разгрузочный с сооружение технологический	технологическая карта на погрузочно-разгрузочные работ с применение подъемного сооружения в производственном корпусе
563806	карта кран мостовый работа технологический	технологическая карта при работе мостового крана
563806	200 400 ду карта клапан оп предохранительный ремонт технологический	технологическая карта на ремонт предохранительного клапана оп ду-200/400
563806	карта не неповоротный ремонт стык технологический труба	технологическая карта не ремонт неповоротных стыков труб
563806	карта опо подъемные разработка сооружение технологический	разработка технологические карты для подъемных сооружений на опо
563806	внутренний высококачественный и карта кирпичный оштукатуривание поверхность простой технологический улучшать штукатурка	технологическая карта на оштукатуривание внутренних кирпичных поверхностей при простой, улучшенной и высококачественной штукатурке
563806	безопасность демонтаж и карта пожарный система средство технический технологический электропроводка	технологическая карта на демонтаж электропроводок и технических средств системы пожарной безопасности
565881	аттестация единый пб портал тестирование	аттестация пб по единому порталу тестирования
565881	аттестация единый портал тестирование	аттестация на едином портале тестирования
566508	государственный документация и и изыскание инженерный кто организация порядок проведение проектный результат устанавливать экспертиза	Кто устанавливает порядок организации и проведения государственной экспертизы проектной документации и результатов инженерных изысканий?
566509	государственный какой капитальный не объект отношение перечисленный проводиться проект строительство экспертиза	В отношении каких из перечисленных объектов капитального строительства государственная экспертиза проектов не проводится
566510	государственный документация и кто объект опасный особо провожать проектный сложный технически экспертиза	Кто проводит государственную экспертизу проектной документации особо опасных и технически сложных объектов
566511	контроль кто проводить строительный	Кто проводит строительный контроль
566512	государственный и какой капитальный надзор объект осуществляться реконструкция строительный строительство строительство	При строительстве и реконструкции каких объектов капитального строительства осуществляется государственный строительный надзор
566513	государственный надзор не предмет строительный являться	Что не является предметом государственного строительного надзора
566515	государственный градостроительный и капитальный кодекс кто надзор объект опасный особо осуществлять относить реконструкция российский сложный строительный строительство строительство технически уникальный федерация	Кто осуществляет государственный строительный надзор за строительством, реконструкцией объектов капитального строительства, отнесенных Градостроительным кодексом Российской Федерации к особо опасным, технически сложным и уникальным
566516	и какой не объект объект опасный опасный особо относиться производственный сложный технически	Какие опасные производственные объекты не относятся к особо опасным и технически сложным объектам
566517	входить градостроительный деятельность законодательство здание или лицо обязанность осуществлять с сооружение соответствие строительство	Что входит в обязанности лица, осуществляющего строительство здания или сооружения, в соответствии с законодательством о градостроительной деятельности
566518	безопасность должный здание или какой обеспечиваться образ процесс сооружение эксплуатация	Каким образом должна обеспечиваться безопасность здания или сооружения в процессе эксплуатации
566519	безопасность вред должный здание здание и и или кто мера население окружающий предупреждать прекращение принимать причинение регламент согласно сооружение сооружение среда технический эксплуатация	Кто должен принять меры, предупреждающие причинение вреда населению и окружающей среде, при прекращении эксплуатации здания или сооружения согласно Техническому регламенту о безопасности зданий и сооружений
566520	а здание здание и и какой обязательный осуществляться оценка процесс с связывать со сооружение сооружение соответствие также форма эксплуатация	В какой форме осуществляется обязательная оценка соответствия зданий и сооружений, а также связанных со зданиями и с сооружениями процессов эксплуатации
566521	документ какой мочь обязательный регулирование сфера технический требование устанавливаться	Какими документами могут устанавливаться обязательные требования в сфере технического регулирования
566522	12 184 2002 27 документ закон какой мочь приниматься регламент регулирование с соответствие технический технический федеральный фз	Какими документами могут приниматься технические регламенты в соответствии с Федеральным законом от 27.12.2002 № 184-ФЗ «О техническом регулировании»
566523	12 184 2002 27 закон какой обязательный подтверждение регулирование соответствие технический устанавливать федеральный фз форма	Какие формы обязательного подтверждения соответствия установлены Федеральным законом от 27.12.2002 № 184-ФЗ «О техническом регулировании»
566525	иметь кто объект опасный право применять провожать производственный сертификация технический устройство	Кто имеет право проводить сертификацию технических устройств, применяемых на опасных производственных объектах
566526	иной начало не объект обязательный оно опасный оценка подлежать применять производственный регламент случай соответствие технический технический технический требование устанавливать устройство устройство форма эксплуатация	В случае если техническим регламентом не установлена иная форма оценки соответствия технического устройства, применяемого на опасном производственном объекте, обязательным требованиям к такому техническому устройству, то до начала эксплуатации оно подлежит
566527	и изготавливать или машина находиться не нужда оборудование подлежать собственный эксплуатация	Машины и оборудование, находящиеся в эксплуатации или изготовленные для собственных нужд, не подлежат
566529	безопасность и какой машина оборудование регламент союз таможенный технический требование устанавливать	Какие требования устанавливает Технический регламент Таможенного союза «О безопасности машин и оборудования»
566531	взрывоопасный во идентификационный оборудование признак работа среда являться	Что является идентификационным признаком оборудования для работы во взрывоопасных средах
566532	безопасность взрывоопасный взрывоопасный вид во во какой классификация не оборудование оборудование работа работа среда среда тр устанавливать	Какие виды классификаций оборудования для работы во взрывоопасных средах не устанавливает ТР «О безопасности оборудования для работы во взрывоопасных средах»
566533	безопасность вид деятельность закон какой лицензирование область подлежать промышленный устанавливаться	В каких законах устанавливаются виды деятельности, подлежащие лицензированию в области промышленной безопасности
566534	04 05 2011 99 безопасность вид вид деятельность деятельность закон лицензирование лицензирование называться область один отдельный подлежать промышленный с соответствие федеральный фз	Как называется один из видов деятельности в области промышленной безопасности, подлежащий лицензированию в соответствии с Федеральным законом от 04.05.2011 № 99-ФЗ «О лицензировании отдельных видов деятельности»
566535	04 05 2011 99 вид действие деятельность закон какой лицензирование лицензия минимальный отдельный срок устанавливать федеральный фз	Какой минимальный срок действия лицензии установлен Федеральным законом от 04.05.2011 № 99-ФЗ «О лицензировании отдельных видов деятельности»
566536	i ii iii взрывопожароопасный вправе документ и и какой класс лицензировать лицензия не объект опасность опасный орган перечисленный производственный соискатель требовать химически эксплуатация	Какие из перечисленных документов не вправе требовать лицензирующий орган у соискателей лицензий на эксплуатацию взрывопожароопасных и химически опасных производственных объектов I, II и III классов опасности
566537	или какой лицензировать лицензия обязывать орган отказ предоставление предоставление принимать решение срок	В какой срок лицензирующий орган обязан принять решение о предоставлении или об отказе в предоставлении лицензии
566538	контроль кто лицензиат лицензионный осуществляться соблюдение требование	Кем осуществляется контроль за соблюдением лицензиатом лицензионных требований
566540	действие какой лицензировать лицензия мочь орган приостанавливать случай	В каком случае лицензирующие органы могут приостанавливать действие лицензии
566541	аннулировать быть какой лицензия мочь решение случай суд	В каком случае лицензия может быть аннулирована решением суда
566542	административный административный вид время вынесение действие деятельность должностной и или какой какой лицензиат лицензировать лицензия лицо назначение наказание орган период приостанавливать приостановление решение ростехнадзор случай срок суд	В какой срок и на какой период времени в случае вынесения решения суда или должностного лица Ростехнадзора о назначении административного наказания в виде административного приостановления деятельности лицензиата лицензирующий орган приостанавливает действие лицензии
566543	авария кто объект опасный причина проводиться производственный расследование технический	Кем проводится техническое расследование причин аварии на опасном производственном объекте
566544	авария государственный и иметь комиссия комиссия кто назначать право председатель принимать причина расследование решение создание технический указанный	Кто имеет право принимать решение о создании государственной комиссии по техническому расследованию причин аварии и назначать председателя указанной комиссии
566545	авария документ какой объект опасный порядок причина проведение производственный расследование технический устанавливаться	В каком документе устанавливается порядок проведения технического расследования причин аварий на опасных производственных объектах
566546	авария вред гражданский кто объект опасный ответственность причинение производственный результат страхователь являться	Кто является страхователями гражданской ответственности за причинение вреда в результате аварии на опасном производственном объекте
