TemplateID	LmQuery	Query
577188	инцидент комиссия объект опасный приказ причина производственный расследование создаваться технический чей	Чьим приказом создается комиссия для технического расследования причин инцидентов на опасном производственном объекте
577189	должный инцидент какой направляться объект опасный орган периодичность производственный происходить ростехнадзор с территориальный	С какой периодичностью должна направляться информация об инцидентах, происшедших на опасных производственных объектах, в территориальный орган Ростехнадзора
577190	бригада выполнять газоопасный и каков количественный коллектор колодец работа работник состав тоннель	Каков количественный состав бригады работников, выполняющих газоопасные работы в колодцах, туннелях и коллекторах
577193	выдача газоопасный допуск кто наряд право предоставляться производство работа	Кому предоставляется право выдачи нарядов-допусков на производство газоопасных работ
577194	выдача выполнение газовый газоопасный газораспределительный документ допуск или иметь иметь какой назначаться наряд организация организация право работа работник служба собственный	Каким документом по газораспределительной организации или организации, имеющей собственную газовую службу, назначаются работники, имеющие право выдачи нарядов-допусков к выполнению газоопасных работ
577195	без выполняться газоопасный допуск инструкция какой мочь наряд оформление производственный работа утверждать	Какие газоопасные работы могут выполняться без оформления наряда-допуска по утвержденным производственным инструкциям
577196	без выполняться газоопасный допуск инструкция какой мочь наряд оформление перечисленный производственный работа утверждать	Какая из перечисленных газоопасных работ может выполняться без оформления наряда-допуска по утвержденной производственной инструкции
577197	выполняться газоопасный газораспределительный какой организация план приводить работа руководитель специальный технический утверждать	Какая из приведенных газоопасных работ выполняется по специальному плану, утвержденному техническим руководителем газораспределительной организации
577198	выполняться газоопасный газораспределительный какой организация план приводить работа руководитель специальный технический утверждать	Какая из приведенных газоопасных работ выполняется по специальному плану, утвержденному техническим руководителем газораспределительной организации
577199	время газоопасный должный допуск какой наряд производство работа течение храниться	В течение какого времени должны храниться наряды-допуски на производство газоопасных работ
577201	выдаваться газоопасный должный кто проведение работа распоряжение	Кем должны выдаваться распоряжения при проведении газоопасной работы
577202	время газоопасный должный какой проводиться работа сутки	В какое время суток должны проводиться газоопасные работы
577204	блочный внутренний газопровод газопровод газорегуляторный газорегуляторный газорегуляторный грп грпб гру далее далее далее далее другой и и контрольный котельная норма оборудование опрессовка производство промышленный пункт пункт пункт регуляторный сельскохозяйственный установка шкафной шрп	Норма контрольной опрессовки внутренних газопроводов промышленных, сельскохозяйственных и других производств, котельных, оборудования и газопроводов газорегуляторных пунктов (далее – ГРП), блочных газорегуляторных пунктов (далее – ГРПБ), шкафных регуляторных пунктов (далее – ШРП), газорегуляторных установок (далее – ГРУ)
577205	весь газопровод давление контрольный наружный норма опрессовка	Норма контрольной опрессовки наружных газопроводов всех давлений
577206	выполняться должно загазованный какой приводить работа ремонтный среда требование	Какое из приведенных требований должно выполняться при ремонтных работах в загазованной среде
577207	загазованный инструмент какой применять работа ремонтный следовать среда	Какой инструмент следует применять при ремонтных работах в загазованной среде
577209	выполнение выполняться газовый газопровод должно и какой коллектор колодец приводить работа резка сварочный тоннель требование	Какое из приведенных требований должно выполняться при выполнении сварочных работ и газовой резки на газопроводах в колодцах, туннелях, коллекторах
577210	0 0 0004 002 выше газ газовый газопровод давление действующий или или какой мера мпа мпа необходимо ниже превышение предел предпринимать проведение происходить резка сварка сверх снижение устанавливать	Какие меры необходимо предпринимать, если при проведении газовой резки (сварки) на действующем газопроводе произошло снижение или превышение давления газа сверх установленных пределов: ниже 0,0004 МПа или выше 0,002 МПа
577212	внутренний газоиспользующий газопровод действовать должный использование какой оборудование образ присоединение проводиться работа резка с сварка	Каким образом должны проводиться работы по присоединению газоиспользующего оборудования к действующим внутренним газопроводам с использованием сварки (резки)
577214	во газ газовый газопровод газопровод давление действующий избежание или какой мера наружный необходимо превышение предпринимать проведение резка сварка	Какие меры необходимо предпринять во избежание превышения давления газа в газопроводе при проведении газовой сварки или резки на действующем наружном газопроводе
577215	газ газопровод какой образ окончание определяться продувка пуск	Каким образом определяется окончание продувки газопровода при пуске газа
577216	газопровод должный доля кислород не объемный окончание после превышать продувка	Объемная доля кислорода в газопроводе после окончания продувки не должна превышать
577217	выполняться газоиспользующий должно и какой оборудование обслуживание ремонт технический требование	Какое требование должно выполняться при техническом обслуживании и ремонте газоиспользующего оборудования
577218	внутренний газопровод должный замена и какой наружный оборудование производиться разборка соблюдение требование установленный	При соблюдении каких требований должна производиться разборка (замена) установленного на наружных и внутренних газопроводах оборудования
577219	газ газопровод должный заглушка какой природный соответствовать требование устанавливать	Каким требованиям должны соответствовать заглушки, устанавливаемые на газопроводы природного газа
577220	газ газопровод давление допускаться замена наружный прокладка соединение фланцевый	Замена прокладок фланцевых соединений на наружных газопроводах допускается при давлении газа
577222	внутренний газ газопровод давление допускаться замена ли прокладка соединение фланцевый	Допускается ли замена прокладок фланцевых соединений на внутренних газопроводах под давлением газа
577962	арматура без внутренний газопровод допускаться и их ли отключение проведение разборка резьбовой соединение фланцевый	Допускается ли проведение разборки фланцевых, резьбовых соединений и арматуры на внутренних газопроводах без их отключения
577965	газ газопровод газопровод давление закупорка заливка или какой металлический пара подача путем разрешаться растворитель устранение шомпол шуровка	При каком давлении газа в газопроводе разрешается устранение в газопроводах закупорок путем шуровки металлическими шомполами, заливки растворителей или подачи пара
577966	герметичность должный закупорка и какой который образ проверяться резьбовой соединение устранение фланцевый	Каким образом должна проверяться герметичность резьбовых и фланцевых соединений, которые разбирались для устранения закупорок
577047	0 1 2 6 включительно газ газопровод давление какой категория мпа относиться с свыше	К какой категории относятся газопроводы с давлением газа свыше 0,6 до 1,2 МПа включительно?
577048	0 0 3 6 включительно газ газопровод давление какой категория мпа относиться с свыше	К какой категории относятся газопроводы с давлением газа свыше 0,3 до 0,6 МПа включительно
577037	а весь гидравлический давление давление другой и и испытание какой оборудование перечислять плотность пробный проверка проводить прочность сварной случай соединение также цель	В каком случае из перечисленных проводят гидравлическое испытание пробным давлением в целях проверки плотности и прочности оборудования под давлением, а также всех сварных и других соединений
577038	дефект же и исправление один проводить раз разрешаться сварной сколько соединение тот участок	Сколько раз разрешается проводить исправление дефектов на одном и том же участке сварного соединения
577040	давление допускаться перечисленный сосуд эксплуатация	Что из перечисленного допускается при эксплуатации сосудов под давлением
577045	газопотребление газораспределение государственный и контроль кто надзор осуществлять сеть эксплуатация	Кто осуществляет государственный контроль (надзор) при эксплуатации сетей газораспределения и газопотребления
577046	время газопотребление газораспределение деятельность документация должный и и исполнительный какой организация осуществлять проектный сеть течение хранить эксплуатация	В течение какого времени организация, осуществляющая деятельность по эксплуатации сетей газораспределения и газопотребления, должна хранить проектную и исполнительную документацию
577051	а безопасность включая газопотребление газораспределение и и какой капитальный консервация ликвидация монтаж не обслуживание они проектирование процесс распространяться регламент реконструкция ремонт ремонт с связывать сеть сеть строительство также текущий технический технический требование эксплуатация	На какие сети, а также на связанные с ними процессы проектирования, строительства, реконструкции, монтажа, эксплуатации (включая техническое обслуживание, текущий ремонт), капитального ремонта, консервации и ликвидации требования Технического регламента о безопасности сетей газораспределения и газопотребления не распространяются
577052	входить газораспределение не перечисленный сеть состав	Что из перечисленного не входит в состав сети газораспределения
577053	газопровод газопровод предназначать продувочный	Продувочный газопровод – газопровод, предназначенный для
577054	безопасность газопотребление газопотребление газораспределение газораспределение и и идентифицироваться какой качество объект признак регламент регулирование сеть сеть существенный технический технический	По каким существенным признакам сети газораспределения и газопотребления идентифицируются в качестве объекта технического регулирования Технического регламента о безопасности сетей газораспределения и газопотребления
577055	газораспределение идентифицироваться какой качество объект приводить регулирование сеть случай технический	В каком из приведенных случаев объект технического регулирования идентифицируется в качестве сети газораспределения
577056	газопотребление идентифицироваться какой качество объект приводить регулирование сеть случай технический	В каком из приведенных случаев объект технического регулирования идентифицируется в качестве сети газопотребления
577057	быть величина газ газоиспользующий газопотребление давление должно значение какой котельная максимальный оборудование отдельно предприятие природный производственный сеть стоять территория	Каким должно быть максимальное значение величины давления природного газа в сетях газопотребления газоиспользующего оборудования в котельных, отдельно стоящих на территории производственных предприятий
577058	быть величина газ газоиспользующий газопотребление давление должно значение какой котельная максимальный оборудование отдельно поселение природный сеть стоять территория	Каким должно быть максимальное значение величины давления природного газа в сетях газопотребления газоиспользующего оборудования в котельных, отдельно стоящих на территории поселений
577059	быть величина газ газоиспользующий газопотребление давление должно жилой жилой здание здание значение какой котельная котельный крышный максимальный оборудование природный пристроенный сеть	Каким должно быть максимальное значение величины давления природного газа в сетях газопотребления газоиспользующего оборудования в котельных, пристроенных к жилым зданиям, крышным котельным жилых зданий
577060	газопотребление газораспределение должный и обеспечивать объект регулирование сеть технический	Что должны обеспечить сети газораспределения и газопотребления как объекты технического регулирования
577061	быть высоковольтный газопровод газопровод должный защитный их какой линия надземный обрыв падение пересечение предотвращать предусматривать случай устройство электропередача электропровод	В каком случае при пересечении надземных газопроводов высоковольтными линиями электропередачи должны быть предусмотрены защитные устройства, предотвращающие падение на газопровод электропроводов при их обрыве
577062	газопровод защитный и какой не обеспечивать покрытие предусматриваться случай сохранность устройство	В каком случае не предусматриваются защитные покрытия и устройства, обеспечивающие сохранность газопровода
577063	быть вход газ газорегуляторный давление должно какой природный установка	Каким должно быть давление природного газа на входе в газорегуляторную установку
577064	быть внутренний газопровод газопровод должно продувочный устанавливать	Что должно быть установлено на продувочном газопроводе внутреннего газопровода
577065	безопасность быть вывод газоиспользующий газопотребление газораспределение должный загазованность здание и и контроль который оборудование оснащать помещение пульт регламент с с сеть сигнал система сооружение соответствие технический требование управление устанавливаться	В соответствии с требованиями Технического регламента о безопасности сетей газораспределения и газопотребления помещения зданий и сооружений, в которых устанавливается газоиспользующее оборудование, должны быть оснащены системами контроля загазованности с выводом сигнала на пульт управления
